corpus,doc_id,sent_id,eg_id,index,text,causal_text_w_pairs,num_rs
NEWS,train84,85,0,0_our_data_0_085,"But unless the military situation changes drastically, military officials say, the most likely plan will be for the Kennedy to eventually replace the carrier Dwight D. Eisenhower, which has been on patrol since March and was scheduled to return to port before hostilities erupted in Kuwait.   ",[],0
NEWS,train334,335,0,cause_our_data_0_0335,The protests -- on the Shiite Muslim holy day Ashura -- were the deadliest since opposition Iranians took to the streets after the disputed June 12 presidential election.,"[""The protests -- on the Shiite Muslim holy day Ashura -- were the deadliest since opposition Iranians <ARG1>took</ARG1> to the streets after the <ARG0>disputed</ARG0> June 12 presidential election.""]",1
NEWS,train23,24,0,intend_our_data_0_024,"Upjohn Co. said it will offer an early retirement package to as many as 1,100 employees in a cost-cutting move expected to result in a fourth-quarter charge.    ","[""Upjohn Co. said it will <ARG0>offer</ARG0> an early retirement package to as many as 1,100 employees in a cost-cutting move expected to result in a fourth-quarter <ARG1>charge</ARG1>.""]",1
NEWS,train148,149,0,0_our_data_0_0149,"Because of program trading it is more difficult to trade many OTC stocks without sharp price moves, a condition known as illiquidity. ",[],0
AFPNEWS,train168,169,0,prevent_our_data_0_0169,Authoritarian China regards democratic and self-ruled Taiwan as its own territory and works to keep the island from becoming diplomatically isolated.,"[""Authoritarian China regards democratic and self-ruled Taiwan as its own territory and <ARG0>works</ARG0> to <SIG0>keep</SIG0> the island from <ARG1>becoming</ARG1> diplomatically isolated.""]",1
NEWS,train276,277,0,cause_our_data_0_0277,"And to protect their reduced capital investment from eroding further, market makers became quicker to lower price quotes when sell programs are in progress. ","[""And to <ARG1>protect</ARG1> their reduced capital investment from eroding further, market makers became quicker to <ARG0>lower</ARG0> price quotes when sell programs are in progress.""]",1
NEWS,train144,145,0,cause_our_data_0_0145,"The supplement contains various information that has been filed with the Securities and Exchange Commission since Dow Jones launched the offer on Sept. 26, but it does n't change the terms and conditions of the offer except to extend its expiration date.    ","[""The supplement contains various information that has been <ARG1>filed</ARG1> with the Securities and Exchange Commission since Dow Jones <ARG0>launched</ARG0> the offer on Sept. 26, but it does nt change the terms and conditions of the offer except to extend its expiration date.""]",1
AFPNEWS,train106,107,0,prevent_our_data_0_0107,"The EU banned Belarusian planes from the bloc's airspace to avoid flying over the ex-Soviet country ruled by Alexander Lukashenko, often dubbed ""Europe's last dictator"".","[""The EU <ARG0>banned</ARG0> Belarusian planes from the blocs airspace to <SIG0>avoid</SIG0> <ARG1>flying</ARG1> over the ex-Soviet country ruled by Alexander Lukashenko, often dubbed Europes last dictator.""]",1
NEWS,train233,234,0,cause_our_data_0_0234,"In the fibers segment, profit rose to $180 million from $155 million, a gain Du Pont attributed to higher demand in the U.S. for most textile products.    ","[""In the fibers segment, profit <ARG1>rose</ARG1> to $180 million from $155 million, a gain Du Pont attributed to higher <ARG0>demand</ARG0> in the U.S. for most textile products.""]",1
NEWS,train267,268,0,cause_our_data_0_0268,The Nikkei index was pressured down by profit-taking triggered by sharp advances made through this week and fell 151.20 points to 35527.29.,"[""The Nikkei index was <ARG1>pressured</ARG1> down by <ARG0>profit-taking</ARG0> triggered by sharp advances made through this week and fell 151.20 points to 35527.29.""]",1
NEWS,train82,83,0,cause_our_data_0_083,"Ocean Drilling amp Exploration Co. will sell its contract-drilling business, and took a $50.9 million loss from discontinued operations in the third quarter because of the planned sale.    ","[""Ocean Drilling amp Exploration Co. will sell its contract-drilling business, and <ARG1>took</ARG1> a $50.9 million loss from discontinued operations in the third quarter because of the <ARG0>planned</ARG0> sale.""]",1
AFPNEWS,train27,28,0,enable_our_data_0_028,"Facebook and Instagram on Wednesday announced plans to let users stop displaying ""like"" tallies racked up by posts, letting people opt out of seeking status through the approval of others.","[""Facebook and Instagram on Wednesday announced <ARG0>plans</ARG0> to <SIG0>let</SIG0> users stop displaying like tallies racked up by posts, <SIG0>let</SIG0>ting people opt out of seeking <ARG1>status</ARG1> through the approval of others.""]",1
NEWS,train90,91,0,0_our_data_0_091,"He adds : "" The last six months have seen a huge increase of censorship on domestic sites and a noticeable attitude by the Chinese government saying they do n't really care what foreigners think.""",[],0
NEWS,train38,39,0,0_our_data_0_039,"The Americans say their battle planscall for operating against forces inside Iraq as far north asthe city of Basra, about 30 miles north of Kuwait, but saythere is n't  any plan to drive beyond that.   ",[],0
NEWS,train352,353,0,cause_our_data_0_0353,"The Google.cn filter, which returns censored search results, was created after the original form of the U.S. - based search engine was routinely slowed or blocked by China's Internet controls.","[""The Google.cn filter, which returns censored search results, was <ARG1>created</ARG1> after the original form of the U.S. - based search engine was routinely slowed or <ARG0>blocked</ARG0> by Chinas Internet controls.""]",1
AFPNEWS,train4,5,0,enable_our_data_0_05,"With The Temenos Banking Cloud, we empower banks to digitally transform and massively scale faster than ever.""","[""With The Temenos Banking <ARG0>cloud</ARG0>, we <SIG0>empower</SIG0> banks to digitally transform and massively <ARG1>scale</ARG1> faster than ever.""]",1
NEWS,train149,150,0,cause_our_data_0_0150,"In the past two months the nation's 88 junk funds have lost a total of about $6 billion -- more than 15% of assets -- through sales or transfers of junk-fund shares, Dalbar says. ","[""In the past two months the nations 88 junk funds have <ARG1>lost</ARG1> a total of about $6 billion -- more than 15% of assets -- through sales or <ARG0>transfers</ARG0> of junk-fund shares, Dalbar says.""]",1
NEWS,train181,182,0,cause_our_data_0_0182,Iraq said the roundup was  to protect them from unspecifiedthreats; British Foreign Office minister William Waldegrave calledthe order ``grave and sinister.'',"[""Iraq said the <ARG0>roundup</ARG0> was  to <ARG1>protect</ARG1> them from unspecifiedthreats; British Foreign Office minister William Waldegrave calledthe order ``grave and sinister.""]",1
AFPNEWS,train0,1,0,enable_our_data_0_01,"""But the minute there's a new international arrest warrant from Italy, which was approved by the Supreme Federal Court of Brazil, the Brazilian federal police can no longer order the expulsion"" he explained.","[""But the minute theres a new international <ARG0>arrest</ARG0> warrant from Italy, which was <SIG0>approve</SIG0>d by the Supreme Federal Court of Brazil, the Brazilian federal police can no longer order the <ARG1>expulsion</ARG1> he explained.""]",1
NEWS,train257,258,0,cause_our_data_0_0258,---   Unisys posted a $648.2 million loss for the third quarter as it moved quickly to take write-offs for various problems and prepare for a turnaround.,"[""---   Unisys posted a $648.2 million <ARG1>loss</ARG1> for the third quarter as it <ARG0>moved</ARG0> quickly to take write-offs for various problems and prepare for a turnaround.""]",1
NEWS,train179,180,0,cause_our_data_0_0180,"Last month, Canadian Bond Rating Service downgraded Provigo's commercial paper and debentures because of its lackluster performance.    ","[""Last month, Canadian Bond Rating Service <ARG1>downgraded</ARG1> Provigos commercial paper and debentures because of its lackluster <ARG0>performance</ARG0>.""]",1
AFPNEWS,train126,127,0,prevent_our_data_0_0127,Thousands of Australian Rules football fans were told to self-isolate and get tested for coronavirus Wednesday after an infected spectator attended a match in Melbourne and the city raced to avoid another lockdown.,"[""Thousands of Australian Rules football fans were told to <ARG0>self-isolate</ARG0> and get tested for coronavirus Wednesday after an infected spectator attended a match in Melbourne and the city raced to <SIG0>avoid</SIG0> another <ARG1>lockdown</ARG1>.""]",1
NEWS,train213,214,0,cause_our_data_0_0214,"Despite these early successes, the mere fact that a groundcampaign has begun almost guarantees that the Bushadministration will face fresh problems growing out of themilitary situation. ","[""Despite these early successes, the mere fact that a groundcampaign has begun almost guarantees that the Bushadministration will face fresh <ARG1>problems</ARG1> growing out of themilitary <ARG0>situation</ARG0>.""]",1
AFPNEWS,train124,125,0,prevent_our_data_0_0125,The move has been seen as part of efforts to shield the increasingly unpopular ruling United Russia party from real competition ahead of parliamentary elections in September.,"[""The <ARG0>move</ARG0> has been seen as part of efforts to <SIG0>shield</SIG0> the increasingly unpopular ruling United Russia party from real <ARG1>competition</ARG1> ahead of parliamentary elections in September.""]",1
NEWS,train258,259,0,cause_our_data_0_0259,The company said it was delaying construction because of current market conditions.,"[""The company said it was <ARG1>delaying</ARG1> construction because of current market <ARG0>conditions</ARG0>.""]",1
NEWS,train219,220,0,cause_our_data_0_0220,And the U.S. now will face sharper questionsin the Arab world since it did n't  back  the peace proposalsworked out in Moscow.,"[""And the U.S. now will <ARG1>face</ARG1> sharper questionsin the Arab world since it did nt  <ARG0>back</ARG0>  the peace proposalsworked out in Moscow.""]",1
AFPNEWS,train79,80,0,enable_our_data_0_080,The country has lifted nearly all virus-related restrictions and many Russians are refusing to wear masks on public transport and in other public places.,"[""The <ARG0>country</ARG0> has <SIG0>lift</SIG0>ed nearly all virus-related restrictions and many Russians are refusing to <ARG1>wear</ARG1> masks on public transport and in other public places.""]",1
NEWS,train205,206,0,cause_our_data_0_0206,"Taken together, the worries prompted a broad sell-off of stocks. ","[""Taken together, the <ARG0>worries</ARG0> prompted a broad <ARG1>sell-off</ARG1> of stocks.""]",1
NEWS,train53,54,0,0_our_data_0_054,"Nashua Corp., rumored a potential takeover target for six months, said that a Dutch company has sought U.S. approval to buy up to 25% of Nashua's shares.    ",[],0
NEWS,train16,17,0,prevent_our_data_0_017,LIN Broadcasting surged 4 5/8 to 112 5/8; LIN and BellSouth sweetened their merger agreement in an attempt to keep shareholders from tendering their shares to McCaw Cellular Communications.,"[""LIN Broadcasting surged 4 5/8 to 112 5/8; LIN and BellSouth <ARG0>sweetened</ARG0> their merger agreement in an attempt to keep shareholders from <ARG1>tendering</ARG1> their shares to McCaw Cellular Communications.""]",1
NEWS,train172,173,0,cause_our_data_0_0173,The earnings growth also was fueled by the company's ability to cut net financing spending by half to around 15 million guilders.,"[""The earnings <ARG1>growth</ARG1> also was fueled by the companys ability to <ARG0>cut</ARG0> net financing spending by half to around 15 million guilders.""]",1
NEWS,train289,290,0,enable_our_data_0_0290,"The White House yesterday disclosed that Kuwait's ousted government has formally asked the U.S. to enforce the total trade embargo the United Nations has imposed on Iraq, allowing the U.S. and other nations to immediately begin stopping ships carrying Iraqi goods.   ","[""The White House yesterday disclosed that Kuwaits ousted government has formally asked the U.S. to <ARG0>enforce</ARG0> the total trade embargo the United Nations has imposed on Iraq, allowing the U.S. and other nations to immediately <ARG1>begin</ARG1> stopping ships carrying Iraqi goods.""]",1
AFPNEWS,train116,117,0,prevent_our_data_0_0117,"The leopards escaped on April 19 -- with careless cage-cleaners blamed for letting them out -- but the Hangzhou Safari Park hid the breakout for nearly three weeks to avoid bad publicity, police in the city have said.","[""The leopards escaped on April 19 -- with careless cage-cleaners blamed for letting them out -- but the Hangzhou Safari Park hid the <ARG0>breakout</ARG0> for nearly three weeks to avoid bad <ARG1>publicity</ARG1>, police in the city have said.""]",1
NEWS,train185,186,0,cause_our_data_0_0186,The president also has offered  to help offsetJordan's costs because 40 percent of its exports go to Iraq and 90percent of its oil comes from there.,"[""The president also has <ARG1>offered</ARG1>  to help offsetJordans costs because 40 percent of its exports go to Iraq and 90percent of its oil <ARG0>comes</ARG0> from there.""]",1
NEWS,train30,31,0,0_our_data_0_031,"When asked about Tuesday's meeting between Israeli Ambassador Gabby Levy and Turkish officials, the Israeli Foreign Ministry said it was pre-planned.",[],0
NEWS,train93,94,0,0_our_data_0_094,"He adds : "" The last six months have seen a huge increase of censorship on domestic sites and a noticeable attitude by the Chinese government saying they do n't really care what foreigners think.""",[],0
NEWS,train97,98,0,0_our_data_0_098,"Indeed, French President Francois Mitterrand saidyesterday that some allied forces are crossing Iraqiterritory as part of a ""pincer"" movement to trap the soldiersoccupying Kuwait, but insisted, ""The purpose isn't to invadeIraqi territory, that's not the aim, that isn't the mandate.""   ",[],0
NEWS,train305,306,0,cause_our_data_0_0306,"""The claims that Maria made were so serious that she was asked by the Department of Homeland Security to come to the U.S. to tell her story.","[""The claims that Maria <ARG0>made</ARG0> were so serious that she was <ARG1>asked</ARG1> by the Department of Homeland Security to come to the U.S. to tell her story.""]",1
NEWS,train243,244,0,cause_our_data_0_0244,And the U.S. is taking similar steps to ensure that its naval force is adequate to carry out a blockade of Iraq and support a war if necessary.,"[""And the U.S. is <ARG0>taking</ARG0> similar steps to <ARG1>ensure</ARG1> that its naval force is adequate to carry out a blockade of Iraq and support a war if necessary.""]",1
NEWS,train107,108,0,0_our_data_0_0108,"""As we regain our leadership level where we have been, and as we continue to put new products into the marketplace and need additional capacity, we will look at resuming our involvement with our plan,"" he said.    ",[],0
NEWS,train189,190,0,cause_our_data_0_0190,"In the year-ago period, Bethlehem earned $101.4 million, or $1.27 a share, including a $3.8 million gain from early retirement of debt.    ","[""In the year-ago period, Bethlehem earned $101.4 million, or $1.27 a share, including a $3.8 million <ARG1>gain</ARG1> from early <ARG0>retirement</ARG0> of debt.""]",1
NEWS,train161,162,0,cause_our_data_0_0162,"Ralston Purina Co. reported a 47% decline in fourth-quarter earnings, reflecting restructuring costs as well as a more difficult pet food market.    ","[""Ralston Purina Co. reported a 47% <ARG1>decline</ARG1> in fourth-quarter earnings, reflecting restructuring <ARG0>costs</ARG0> as well as a more difficult pet food market.""]",1
AFPNEWS,train174,175,0,prevent_our_data_0_0175,"Traditional pumps may contain different materials, including metal components that can in some cases complicate the recycling process.","[""Traditional <ARG0>pumps</ARG0> may <SIG0>contain</SIG0> different materials, including metal components that can in some cases complicate the <ARG1>recycling</ARG1> process.""]",1
NEWS,train99,100,0,0_our_data_0_0100,"That's largely because of defensive measures they adopted after the 1987 crash, when individual investors fled the market and trading activity dwindled. ",[],0
NEWS,train283,284,0,enable_our_data_0_0284,Dow Jones said it extended the offer to allow shareholders time to review a supplement to the Dow Jones tender offer circular that it mailed last Friday.,"[""Dow Jones said it <ARG0>extended</ARG0> the offer to allow shareholders time to <ARG1>review</ARG1> a supplement to the Dow Jones tender offer circular that it mailed last Friday.""]",1
NEWS,train76,77,0,0_our_data_0_077,"Of course, it is still far too early to assume that themilitary situation on the ground will stay as smooth forallied forces as it appears to have been so far. ",[],0
NEWS,train64,65,0,0_our_data_0_065,"Although many of the transactions related to those securities have n't been completed, Columbia said the ultimate gain on the sale of those assets will range from $200 million to $300 million. ",[],0
AFPNEWS,train93,94,0,enable_our_data_0_094,This provides the perfect conditions for the bacteria to thrive and cause inflammation-causing toxins that are known to spread throughout the rest of the body.,"[""<ARG0>This</ARG0> <SIG0>provide</SIG0>s the perfect conditions for the bacteria to thrive and cause inflammation-causing <ARG1>toxins</ARG1> that are known to spread throughout the rest of the body.""]",1
NEWS,train122,123,0,0_our_data_0_0123,The Nikkei index was pressured down by profit-taking triggered by sharp advances made through this week and fell 151.20 points to 35527.29.,[],0
NEWS,train28,29,0,0_our_data_0_029,Integra-A Hotel amp Restaurant Co. said its planned rights offering  to raise about $9 million  was declared effective and the company  will begin mailing materials to shareholders at the end of this week.,[],0
NEWS,train321,322,0,cause_our_data_0_0322,The company has acknowledged a software glitch that is causing problems with its braking.,"[""The company has <ARG1>acknowledged</ARG1> a software glitch that is <ARG0>causing</ARG0> problems with its braking.""]",1
NEWS,train100,101,0,cause_our_data_0_0101,The move boosts Intelogic Chairman Asher Edelman's stake to 20% from 16.2% and may help prevent Martin Ackerman from making a run at the computer-services concern.,"[""The <ARG0>move</ARG0> <ARG1>boosts</ARG1> Intelogic Chairman Asher Edelmans stake to 20% from 16.2% and may help prevent Martin Ackerman from making a run at the computer-services concern.""]",1
NEWS,train39,40,0,0_our_data_0_040,"A few days later, American Medical announced sharply lower earnings, taking charges of $24 million for insurance reserves and canceled real estate leases.    ",[],0
NEWS,train315,316,0,cause_our_data_0_0316,"The debate over how to alleviate those shortages has intensified in recent years, pitching advocates of privatization programs against those who say water is a public good and that its collection and distribution should remain in the public sector.","[""The debate over how to alleviate those shortages has <ARG0>intensified</ARG0> in recent years, <ARG1>pitching</ARG1> advocates of privatization programs against those who say water is a public good and that its collection and distribution should remain in the public sector.""]",1
AFPNEWS,train49,50,0,enable_our_data_0_050,"In developing the concept for Future, Aptar's experts turned to recognized eco-design principles, which call for plastic dispensing products to be made from a mono-material to facilitate the recycling process.","[""In developing the concept for Future, Aptars experts turned to recognized eco-design principles, which call for plastic dispensing products to be made from a <ARG0>mono-material</ARG0> to <SIG0>facilitate</SIG0> the <ARG1>recycling</ARG1> process.""]",1
NEWS,train1,2,0,0_our_data_0_02,He also rejected reports that his departure stemmed from disappointment the general manager's post had n't  also led to a board directorship at the London-based news organization.,[],0
NEWS,train237,238,0,cause_our_data_0_0238,"Even as Saddam Hussein was searching for a ploy to ease his isolation, though, the international pressure against him clicked up another notch. ","[""Even as Saddam Hussein was searching for a ploy to ease his <ARG0>isolation</ARG0>, though, the international pressure against him <ARG1>clicked</ARG1> up another notch.""]",1
AFPNEWS,train24,25,0,enable_our_data_0_025,China's central bank also granted a $1.5 billion currency swap to finance imports from China in February as the rupee hit a record low of 202.73 to the dollar.,"[""Chinas central <ARG0>bank</ARG0> also <SIG0>grant</SIG0>ed a $1.5 billion currency swap to <ARG1>finance</ARG1> imports from China in February as the rupee hit a record low of 202.73 to the dollar.""]",1
NEWS,train15,16,0,0_our_data_0_016,"While this indicates continued strong demand for the company's desk-top computers, Sun faces increasing competition from Digital Equipment Corp. and Hewlett-Packard Co. Recently, analysts have said Sun also is vulnerable to competition from International Business Machines Corp., which plans to introduce a group of workstations early next year, and Next Inc. ",[],0
NEWS,train131,132,0,cause_our_data_0_0132,Rights attached to the company's common shares were issued that are triggered if a hostile bidder acquires more than 20% of the shares outstanding.,"[""Rights attached to the companys common shares were <ARG0>issued</ARG0> that are triggered if a hostile bidder <ARG1>acquires</ARG1> more than 20% of the shares outstanding.""]",1
NEWS,train340,341,0,cause_our_data_0_0341,"Choudary has never announced a date for his march and area police said he had not contacted them about it, as march organizers are required to do beforehand.","[""Choudary has never <ARG1>announced</ARG1> a date for his march and area police said he had not contacted them about it, as march organizers are <ARG0>required</ARG0> to do beforehand.""]",1
NEWS,train26,27,0,intend_our_data_0_027,"The message to the chief of staff was meant to be taken as a suggestionthat Sununu offer to resign, one highly placed source said. ","[""The <ARG0>message</ARG0> to the chief of staff was meant to be <ARG1>taken</ARG1> as a suggestionthat Sununu offer to resign, one highly placed source said.""]",1
NEWS,train100,101,0,0_our_data_0_0101,"According to department policy, prosecutors must make a strong showing that lawyers' fees came from assets tainted by illegal profits before any attempts at seizure are made.    ",[],0
NEWS,train137,138,0,cause_our_data_0_0138,"They've been given a mandate from Switzerland"" to expand their U.S. chocolate operations. ","[""Theyve been <ARG0>given</ARG0> a mandate from Switzerland to <ARG1>expand</ARG1> their U.S. chocolate operations.""]",1
NEWS,train8,9,0,0_our_data_0_09,"Anheuser said it continues to hold to its earlier-announced goal of a 50% U.S. market share by the mid-1990s.    Beneath the tepid news-release jargon lies a powerful threat from the brewing giant, which last year accounted for about 41% of all U.S. beer sales and is expected to see that grow to 42.5% in the current year. ",[],0
AFPNEWS,train134,135,0,prevent_our_data_0_0135,Regular OralHealth CheckUps Partner with your dental professional regularly to prevent and detect signs of gum infection at its earliest stages,"[""Regular OralHealth <ARG0>CheckUps</ARG0> Partner with your dental professional regularly to <SIG0>prevent</SIG0> and detect signs of gum <ARG1>infection</ARG1> at its earliest stages""]",1
NEWS,train115,116,0,cause_our_data_0_0116,"Dataproducts Inc. said it filed a lawsuit in Delaware Chancery Court to block a tender offer by DPC Acquisition Partners, alleging that the hostile offer violates a standstill agreement between the two concerns.    ","[""Dataproducts Inc. said it <ARG0>filed</ARG0> a lawsuit in Delaware Chancery Court to <ARG1>block</ARG1> a tender offer by DPC Acquisition Partners, alleging that the hostile offer violates a standstill agreement between the two concerns.""]",1
NEWS,train129,130,0,cause_our_data_0_0130,"Analysts noted that over the past 20 years, Mr. Fournier has built his company through astute stock-market activity and has warded off at least three takeover attempts. ","[""Analysts noted that over the past 20 years, Mr. Fournier has <ARG1>built</ARG1> his company through astute stock-market <ARG0>activity</ARG0> and has warded off at least three takeover attempts.""]",1
NEWS,train21,22,0,intend_our_data_0_022,Courtaulds PLC announced plans to spin off its textiles operations to existing shareholders in a restructuring to boost shareholder value.,"[""Courtaulds PLC announced plans to <ARG0>spin</ARG0> off its textiles operations to existing shareholders in a restructuring to <ARG1>boost</ARG1> shareholder value.""]",1
NEWS,train304,305,0,cause_our_data_0_0305,He told me he wanted to see his mummy then I started crying and said'I do n't think you're ever going to see your mummy again.',"[""He told me he <ARG0>wanted</ARG0> to see his mummy then I started <ARG1>crying</ARG1> and saidI do nt think youre ever going to see your mummy again.""]",1
NEWS,train34,35,0,intend_our_data_0_035,"Philip Morris Cos., New York, adopted a defense measure designed to make a hostile takeover prohibitively expensive.    ","[""Philip Morris Cos., New York, <ARG0>adopted</ARG0> a defense measure designed to <ARG1>make</ARG1> a hostile takeover prohibitively expensive.""]",1
