corpus,doc_id,sent_id,eg_id,index,text,causal_text_w_pairs,num_rs
NEWS,train332,333,0,cause_our_data_0_0333,"But, he said football was helping keep people at home as University of Alabama fans cheered on their team in the National Championship Game against the University of Texas.","[""But, he said football was helping <ARG1>keep</ARG1> people at home as University of Alabama fans <ARG0>cheered</ARG0> on their team in the National Championship Game against the University of Texas.""]",1
NEWS,train317,318,0,cause_our_data_0_0318,The Texas legislature adopted the plan in 2003 after three contentious special sessions called by Republican Gov.,"[""The Texas legislature <ARG1>adopted</ARG1> the plan in 2003 after three contentious special sessions <ARG0>called</ARG0> by Republican Gov.""]",1
NEWS,train52,53,0,intend_our_data_0_053,"Cineplex Odeon Corp. directors said the company's chairman and chief executive, Garth Drabinsky, is considering bidding 780.6 million Canadian dollars (US$666 million) to acquire the company.    ","[""Cineplex Odeon Corp. directors said the companys chairman and chief executive, Garth Drabinsky, is considering <ARG0>bidding</ARG0> 780.6 million Canadian dollars (US$666 million) to <ARG1>acquire</ARG1> the company.""]",1
NEWS,train346,347,0,cause_our_data_0_0347,"But in recent years as Spain has enlisted increased cooperation from France in cracking down on ETA hideouts, there have been various exchanges of gunfire between ETA suspects and French police, wounding some officers.","[""But in recent years as Spain has <ARG0>enlisted</ARG0> increased cooperation from France in cracking down on ETA hideouts, there have been various exchanges of gunfire between ETA suspects and French police, <ARG1>wounding</ARG1> some officers.""]",1
NEWS,train95,96,0,0_our_data_0_096,"The company said it estimates the Desert Inn remodeling will cost about $32 million, and the refurbishment of the three DC-8-62 aircraft, made by McDonnell Douglas Corp., will cost around $24.5 million.    ",[],0
AFPNEWS,train42,43,0,enable_our_data_0_043,"If they beat Chelsea, City will have completed a memorable treble after clinching the Premier League title and lifting the League Cup earlier this season.","[""If they <ARG0>beat</ARG0> Chelsea, City will have completed a memorable <ARG1>treble</ARG1> after clinching the Premier League title and <SIG0>lift</SIG0>ing the League Cup earlier this season.""]",1
NEWS,train140,141,0,0_our_data_0_0141,"Profit also suffered because of ""intense"" discounting in its long-haul trucking business, the company said.    ",[],0
AFPNEWS,train59,60,0,enable_our_data_0_060,"It gives Amazon the fabled Metro Goldwyn Mayer studios, an iconic name in Hollywood which has been through a series of ownership changes and bankruptcy in recent years.","[""<ARG0>It</ARG0> <SIG0>give</SIG0>s Amazon the fabled Metro Goldwyn Mayer <ARG1>studios</ARG1>, an iconic name in Hollywood which has been through a series of ownership changes and bankruptcy in recent years.""]",1
AFPNEWS,train142,143,0,prevent_our_data_0_0143,-- Regular Oral-Health Check-Ups Partner with your dental professional regularly to prevent and detect signs of gum infection at its earliest stages.,"[""-- Regular Oral-Health Check-Ups Partner with your dental <ARG0>professional</ARG0> regularly to <SIG0>prevent</SIG0> and detect signs of gum <ARG1>infection</ARG1> at its earliest stages.""]",1
NEWS,train18,19,0,0_our_data_0_019,"Ogden Projects, which has interests in solid-waste recovery and hazardous-waste cleanup, said it has 13 facilities in operation, up from seven a year ago.    ",[],0
NEWS,train359,360,0,enable_our_data_0_0360,"Elected in 1810, he signed an obscure redistricting bill that enabled greater and perhaps disproportionate Republican representation in the Massachusetts legislature.","[""Elected in 1810, he <ARG0>signed</ARG0> an obscure redistricting bill that <ARG1>enabled</ARG1> greater and perhaps disproportionate Republican representation in the Massachusetts legislature.""]",1
NEWS,train110,111,0,0_our_data_0_0111,Last Friday's announcement was the first official word that the project was in trouble and that the company's plans for a surge in market share may have been overly optimistic.,[],0
NEWS,train162,163,0,0_our_data_0_0163,LIN Broadcasting surged 4 5/8 to 112 5/8; LIN and BellSouth sweetened their merger agreement in an attempt to keep shareholders from tendering their shares to McCaw Cellular Communications.,[],0
NEWS,train1,2,0,prevent_our_data_0_02,"Subcontractors  will  be offered a settlement and a swift transition to new management  is expected  to avert an exodus of skilled workers from Waertsilae Marine's two big shipyards, government officials said.    ","[""Subcontractors  will  be offered a settlement and a swift <ARG0>transition</ARG0> to new management  is expected  to avert an <ARG1>exodus</ARG1> of skilled workers from Waertsilae Marines two big shipyards, government officials said.""]",1
NEWS,train266,267,0,cause_our_data_0_0267,"Other dealers added that the blue-chip stocks in general were hit by profit-taking over concerns that London shares will continue posting declines and the uncertainty over sterling given that Mr. Lawson's successor, John Major, had only been in the job one day.    ","[""Other dealers added that the blue-chip stocks in general were <ARG1>hit</ARG1> by profit-taking over concerns that London shares will continue <ARG0>posting</ARG0> declines and the uncertainty over sterling given that Mr. Lawsons successor, John Major, had only been in the job one day.""]",1
NEWS,train68,69,0,0_our_data_0_069,The company said it amended its shareholder rights plan by reducing to 10% from 20% the level of ownership by an outsider that would trigger the issuance to other holders of rights to buy additional shares of Nashua common at half price.,[],0
NEWS,train78,79,0,0_our_data_0_079,"A spokesman for the Stamford, Conn.based company said operations had a loss of $5.5 million for the quarter; in addition, the loss was magnified by nonrecurring charges totaling $23.5 million and $8.2 million in asset-valuation adjustments that he described as ""unusual."" ",[],0
NEWS,train309,310,0,cause_our_data_0_0310,"Many of our staff have tried to leave, but were unsuccessful because the walls from buildings and private residences are falling into the streets, so that it has pretty much blocked significantly most of the traffic. ""","[""Many of our staff have tried to leave, but were unsuccessful because the walls from buildings and private residences are <ARG0>falling</ARG0> into the streets, so that it has pretty much <ARG1>blocked</ARG1> significantly most of the traffic.""]",1
NEWS,train40,41,0,intend_our_data_0_041,"Replied State Department deputy spokesman Richard Boucher, ``Wehave n't  really analyzed the statement in detail but it appears tobe just another example of his outlandish rhetoric and his attempts to distort the truth.   ","[""Replied State Department deputy spokesman Richard Boucher, ``Wehave nt  really analyzed the <ARG0>statement</ARG0> in detail but it appears tobe just another example of his outlandish rhetoric and his attempts to <ARG1>distort</ARG1> the truth.""]",1
NEWS,train45,46,0,intend_our_data_0_046,The SEC has alleged that Mr. Antar aimed to pump up the company's stock price through false financial statements in order to sell his stake and reap huge profits.,"[""The SEC has alleged that Mr. Antar aimed to <ARG0>pump</ARG0> up the companys stock price through false financial statements in order to <ARG1>sell</ARG1> his stake and reap huge profits.""]",1
NEWS,train252,253,0,cause_our_data_0_0253,"However, the company's petroleum services segment, while profitable, was hurt by high financing costs associated with the company's buy-out of a 50% stake in Eastman Christensen Co. from Texas Eastern Corp. last June. ","[""However, the companys petroleum services segment, while profitable, was <ARG1>hurt</ARG1> by high financing costs associated with the companys <ARG0>buy-out</ARG0> of a 50% stake in Eastman Christensen Co. from Texas Eastern Corp. last June.""]",1
NEWS,train60,61,0,intend_our_data_0_061,It also was considering a restructuring to help boost the stock price.,"[""It also was considering a <ARG0>restructuring</ARG0> to <ARG1>help</ARG1> boost the stock price.""]",1
NEWS,train56,57,0,intend_our_data_0_057,So Saddam Hussein on Friday tried to scare other Arab leaders into supporting him by calling onArabs to rise up in a holy war against leaders who invited American and other Western soldiers into Saudi Arabia to protect the oil-rich kingdom.,"[""So Saddam Hussein on Friday tried to <ARG1>scare</ARG1> other Arab leaders into supporting him by <ARG0>calling</ARG0> onArabs to rise up in a holy war against leaders who invited American and other Western soldiers into Saudi Arabia to protect the oil-rich kingdom.""]",1
NEWS,train38,39,0,intend_our_data_0_039,"Mr. Lortie's departure, while sudden, was seen as inevitable in light of the shift in strategy. ","[""Mr. Lorties <ARG0>departure</ARG0>, while sudden, was seen as inevitable in light of the <ARG1>shift</ARG1> in strategy.""]",1
AFPNEWS,train52,53,0,enable_our_data_0_053,"Tools being added to the services will let users turn off ""like"" features on individual posts or all of them, according to Mosseri.","[""<ARG0>Tools</ARG0> being added to the services will <SIG0>let</SIG0> users <ARG1>turn off</ARG1> like features on individual posts or all of them, according to Mosseri.""]",1
NEWS,train154,155,0,0_our_data_0_0155,"And to protect their reduced capital investment from eroding further, market makers became quicker to lower price quotes when sell programs are in progress. ",[],0
NEWS,train65,66,0,cause_our_data_0_066,"In anticipation of the start-up of its new factory, the company said a larger-than-normal chassis supply  has  been built  to carry it through the transition period. ","[""In anticipation of the start-up of its new factory, the company said a larger-than-normal chassis supply  has  been <ARG0>built</ARG0>  to <ARG1>carry</ARG1> it through the transition period.""]",1
NEWS,train246,247,0,cause_our_data_0_0247,"GMAC said its automotive financing and leasing business rose 35% in the U.S., largely because of dealer and customer incentives used to boost sales. ","[""GMAC said its automotive financing and leasing business <ARG1>rose</ARG1> 35% in the U.S., largely because of dealer and customer incentives <ARG0>used</ARG0> to boost sales.""]",1
NEWS,train10,11,0,0_our_data_0_011,"There was no independentconfirmation of the report by the government-run news agency, whichdid not say when the reported attempt occurred.",[],0
NEWS,train17,18,0,0_our_data_0_018,The New Orleans oil and gas exploration and diving operations company added that it does n't expect any further adverse financial impact from the restructuring.,[],0
NEWS,train163,164,0,cause_our_data_0_0164,"Ralston attributed its fourth-quarter slump partly to higher costs of ingredients in the pet food business as well as competitive pressures, which required higher advertising spending. ","[""Ralston attributed its fourth-quarter <ARG1>slump</ARG1> partly to higher <ARG0>costs</ARG0> of ingredients in the pet food business as well as competitive pressures, which required higher advertising spending.""]",1
NEWS,train319,320,0,cause_our_data_0_0320,"As the census gets underway, Prewitt said trying to count everyone, as mandated by the Constitution, should be the top concern.""","[""As the census gets underway, Prewitt said <ARG1>trying</ARG1> to count everyone, as <ARG0>mandated</ARG0> by the Constitution, should be the top concern.""]",1
AFPNEWS,train123,124,0,prevent_our_data_0_0124,"Several EU countries have restricted the use of AstraZeneca's vaccine to older people, typically over 55 or 60.","[""Several EU <ARG0>countries</ARG0> have <SIG0>restrict</SIG0>ed the use of AstraZenecas <ARG1>vaccine</ARG1> to older people, typically over 55 or 60.""]",1
NEWS,train93,94,0,cause_our_data_0_094,"Earnings at Xerox's financial-services operations actually rose slightly, but that was largely because capital gains at Crum amp Forster offset Hurricane Hugo payments and the reserves set up  to cover future payments.    ","[""Earnings at Xeroxs financial-services operations actually <ARG1>rose</ARG1> slightly, but that was largely because capital gains at Crum amp Forster <ARG0>offset</ARG0> Hurricane Hugo payments and the reserves set up  to cover future payments.""]",1
AFPNEWS,train82,83,0,enable_our_data_0_083,"With its restructuring plan approved by Norwegian and Irish courts, the company can now emerge from bankruptcy protection.","[""With its restructuring <ARG0>plan</ARG0> <SIG0>approve</SIG0>d by Norwegian and Irish courts, the company can now emerge from <ARG1>bankruptcy</ARG1> protection.""]",1
NEWS,train14,15,0,prevent_our_data_0_015,"Secretary of State James Baker, speaking on ABC News' ""This Week,"" said the Kuwaiti request gives the U.S. and other countries ""a legal basis for stopping the export of oil and that sort of thing."" ","[""Secretary of State James Baker, speaking on ABC News This Week, said the Kuwaiti <ARG1>request</ARG1> gives the U.S. and other countries a legal basis for stopping the <ARG0>export</ARG0> of oil and that sort of thing.""]",1
NEWS,train13,14,0,0_our_data_0_014,"Mr. Roberts continues as treasurer, and Mr. Wonham remains responsible for the offices of comptroller, planning, marketing and general services.    ",[],0
NEWS,train81,82,0,0_our_data_0_082,"Benjamin Franklin Federal Savings amp Loan Association said it plans to restructure in the wake of a third-quarter loss of $7.7 million, or $1.01 a share, reflecting an $11 million addition to loan-loss reserves.    ",[],0
NEWS,train79,80,0,0_our_data_0_080,A spokeswoman for Crum amp Forster said employees  were told early this week that numerous staff functions for the personal insurance lines  were going  to  be centralized as a cost-cutting move.,[],0
NEWS,train229,230,0,cause_our_data_0_0230,"The profit gain was made despite a weakening in the housing market, for which the company is a supplier, and a strengthening in the dollar, which lowers the value of overseas earnings when they are translated into dollars.    ","[""The profit gain was made despite a weakening in the housing market, for which the company is a supplier, and a <ARG0>strengthening</ARG0> in the dollar, which <ARG1>lowers</ARG1> the value of overseas earnings when they are translated into dollars.""]",1
NEWS,train169,170,0,cause_our_data_0_0170,N.V. DSM said net income in the third quarter jumped 63% as the company had substantially lower extraordinary charges to account for a restructuring program.,"[""N.V. DSM said net income in the third quarter <ARG1>jumped</ARG1> 63% as the company had substantially lower extraordinary <ARG0>charges</ARG0> to account for a restructuring program.""]",1
AFPNEWS,train91,92,0,enable_our_data_0_092,"Oral-B was founded in 1950 by Dr. Robert Hutson, a California periodontist, who invented an innovative toothbrush to help his patients achieve healthier teeth and gums at home.","[""Oral-B was founded in 1950 by Dr. Robert Hutson, a California periodontist, who invented an innovative <ARG0>toothbrush</ARG0> to <SIG0>help</SIG0> his patients achieve healthier <ARG1>teeth</ARG1> and gums at home.""]",1
AFPNEWS,train113,114,0,prevent_our_data_0_0114,Total said it would continue to produce gas so as not to disrupt electricity supply in either country.,"[""Total said it would continue to <ARG0>produce</ARG0> gas so as not to <ARG1><SIG0>disrupt</SIG0></ARG1> electricity supply in either country.""]",1
NEWS,train132,133,0,0_our_data_0_0133,"Since 1983, Westinghouse has shed 70 businesses that it did n't expect to produce 10% operating margins while acquiring 55 businesses.    ",[],0
NEWS,train116,117,0,cause_our_data_0_0117,"Dataproducts Inc. said it filed a lawsuit in Delaware Chancery Court to block a tender offer by DPC Acquisition Partners, alleging that the hostile offer violates a standstill agreement between the two concerns.    ","[""Dataproducts Inc. said it filed a <ARG0>lawsuit</ARG0> in Delaware Chancery Court to <ARG1>block</ARG1> a tender offer by DPC Acquisition Partners, alleging that the hostile offer violates a standstill agreement between the two concerns.""]",1
NEWS,train126,127,0,cause_our_data_0_0127,"Compaq Computer Corp. said that its net income rose 51% in the third quarter, bolstered by unusual gains from its investment in a disk-drive maker and reflecting continued growth in its European operations.    ","[""Compaq Computer Corp. said that its net income rose 51% in the third quarter, bolstered by unusual <ARG1>gains</ARG1> from its <ARG0>investment</ARG0> in a disk-drive maker and reflecting continued growth in its European operations.""]",1
NEWS,train223,224,0,cause_our_data_0_0224,"On Friday, Intel began notifying customers about the bugs which cause the chip to give wrong answers for some mathematical calculations.    ","[""On Friday, Intel began notifying customers about the <ARG0>bugs</ARG0> which cause the chip to give wrong <ARG1>answers</ARG1> for some mathematical calculations.""]",1
AFPNEWS,train169,170,0,prevent_our_data_0_0170,"Facebook and Instagram on Wednesday announced plans to let users stop displaying ""like"" tallies racked up by posts, letting people opt out of seeking status through the approval of others.","[""Facebook and Instagram on Wednesday announced <ARG0>plans</ARG0> to let users <SIG0>stop</SIG0> <ARG1>displaying</ARG1> like tallies racked up by posts, letting people opt out of seeking status through the approval of others.""]",1
AFPNEWS,train173,174,0,prevent_our_data_0_0174,There have been calls to revamp the UN health agency as well as the entire global approach to health to avoid future catastrophes.,"[""There have been calls to <ARG0>revamp</ARG0> the UN health agency as well as the entire global approach to health to <SIG0>avoid</SIG0> future <ARG1>catastrophes</ARG1>.""]",1
NEWS,train224,225,0,cause_our_data_0_0225,"Nonetheless, concern about the chip may have been responsible for a decline of 87.5 cents in Intel's stock to $32 a share yesterday in over-the-counter trading, on volume of 3,609,800 shares, and partly responsible for a drop in Compaq's stock in New York Stock Exchange composite trading on Wednesday. ","[""Nonetheless, <ARG0>concern</ARG0> about the chip may have been responsible for a <ARG1>decline</ARG1> of 87.5 cents in Intels stock to $32 a share yesterday in over-the-counter trading, on volume of 3,609,800 shares, and partly responsible for a drop in Compaqs stock in New York Stock Exchange composite trading on Wednesday.""]",1
AFPNEWS,train97,98,0,enable_our_data_0_098,"Amazon has agreed to buy the storied MGM studios for $8.45 billion, the companies said Wednesday, giving the US tech giant a vast content library to further its ambitions in streaming.","[""Amazon has agreed to <ARG0>buy</ARG0> the storied MGM studios for $8.45 billion, the companies said Wednesday, giving the US tech giant a vast content library to further its <ARG1>ambitions</ARG1> in streaming.""]",1
NEWS,train324,325,0,cause_our_data_0_0325,"Even if the solution ends up being a relatively simple and inexpensive software adjustment, the Prius braking problems come at a bad time for Toyota, which has seen its prized reputation for quality and safety badly damaged by the recalls and the news attention given to them.","[""Even if the solution ends up being a relatively simple and inexpensive software adjustment, the Prius braking problems come at a bad time for Toyota, which has seen its prized reputation for quality and safety badly <ARG1>damaged</ARG1> by the recalls and the news attention <ARG0>given</ARG0> to them.""]",1
NEWS,train46,47,0,intend_our_data_0_047,The SEC has alleged that Mr. Antar aimed to pump up the company's stock price through false financial statements in order to sell his stake and reap huge profits.,"[""The SEC has alleged that Mr. Antar aimed to <ARG0>pump</ARG0> up the companys stock price through false financial statements in order to sell his stake and <ARG1>reap</ARG1> huge profits.""]",1
NEWS,train225,226,0,cause_our_data_0_0226,"Nonetheless, concern about the chip may have been responsible for a decline of 87.5 cents in Intel's stock to $32 a share yesterday in over-the-counter trading, on volume of 3,609,800 shares, and partly responsible for a drop in Compaq's stock in New York Stock Exchange composite trading on Wednesday. ","[""Nonetheless, <ARG0>concern</ARG0> about the chip may have been responsible for a decline of 87.5 cents in Intels stock to $32 a share yesterday in over-the-counter trading, on volume of 3,609,800 shares, and partly responsible for a <ARG1>drop</ARG1> in Compaqs stock in New York Stock Exchange composite trading on Wednesday.""]",1
AFPNEWS,train161,162,0,prevent_our_data_0_0162,"Morocco recently eased restrictions imposed to control the spread of the coronavirus, shortening a night-time curfew, but a long-standing state of emergency over the health crisis has been extended until June 10.","[""Morocco recently eased <ARG0>restrictions</ARG0> imposed to <SIG0>control</SIG0> the spread of the <ARG1>coronavirus</ARG1>, shortening a night-time curfew, but a long-standing state of emergency over the health crisis has been extended until June 10.""]",1
NEWS,train74,75,0,0_our_data_0_075,The directors added that the two executives have n't reached a final decision to proceed with a bid and that until an offer is made the board will continue seeking higher offers from other bidders.,[],0
AFPNEWS,train80,81,0,enable_our_data_0_081,"He urged the Malian and French authorities ""to do everything to secure his freedom"".","[""He urged the Malian and French <ARG0>authorities</ARG0> to do everything to <SIG0>secure</SIG0> his <ARG1>freedom</ARG1>.""]",1
NEWS,train298,299,0,cause_our_data_0_0299,"While a prisoner, Maria witnessed a sickening trade in human life and recalls how young girls were drugged, forced into prostitution and then murdered.","[""While a prisoner, Maria <ARG0>witnessed</ARG0> a sickening trade in human life and recalls how young girls were drugged, <ARG1>forced</ARG1> into prostitution and then murdered.""]",1
NEWS,train70,71,0,0_our_data_0_071,"Paribas said Monday that it intends to bid to boost its stake in Navigation Mixte to 66.7%, from the 18.7% it already owns. ",[],0
NEWS,train249,250,0,cause_our_data_0_0250,"It received more offers, but the auction was surprisingly won by IMA, which bid $28 a share and asked Mr. Gilleland to stay on as an equity participant. ","[""It received more offers, but the auction was surprisingly <ARG0>won</ARG0> by IMA, which <ARG1>bid</ARG1> $28 a share and asked Mr. Gilleland to stay on as an equity participant.""]",1
NEWS,train139,140,0,0_our_data_0_0140,"Revenue totaled $1.01 billion, a 43% increase from $704.4 million, reflecting the company's acquisition of Emery earlier this year.    ",[],0
NEWS,train137,138,0,0_our_data_0_0138,Company officials also said that any gain from the sale of Westinghouse's 55% stake in its transmission and distribution venture with the Swiss firm of Asea Brown Boveri will be offset by a restructuring charge in the fourth quarter.,[],0
NEWS,train142,143,0,0_our_data_0_0143,"""They have to continue to tighten their belts,"" said Craig Kloner, an analyst at Goldman, Sachs amp Co. ",[],0
NEWS,train31,32,0,intend_our_data_0_032,"DPC, an investor group led by New York-based Crescott Investment Associates, had itself filed a suit in state court in Los Angeles seeking to nullify the agreement. ","[""DPC, an investor group led by New York-based Crescott Investment Associates, had itself <ARG0>filed</ARG0> a suit in state court in Los Angeles seeking to <ARG1>nullify</ARG1> the agreement.""]",1
NEWS,train214,215,0,cause_our_data_0_0215,President Bush's political argument for going to a groundwar has been strengthened by the growing stream of reports ofwanton Iraqi destruction inside Kuwait.,"[""President Bushs political <ARG1>argument</ARG1> for going to a groundwar has been strengthened by the growing stream of reports ofwanton Iraqi <ARG0>destruction</ARG0> inside Kuwait.""]",1
NEWS,train155,156,0,cause_our_data_0_0156,"At the same time, the sheer size of the loss, coupled with a slowing of orders, made some securities analysts wonder just how strong that turnaround will be at the computer maker and defense-electronics concern.    ","[""At the same time, the sheer size of the <ARG0>loss</ARG0>, coupled with a slowing of orders, made some securities analysts <ARG1>wonder</ARG1> just how strong that turnaround will be at the computer maker and defense-electronics concern.""]",1
NEWS,train7,8,0,0_our_data_0_08,"In the filing, Crane said that in the past it considered seeking control of Milton Roy, of St. Petersburg, Fla., through a merger or tender offer and that it expects to continue to evaluate an acquisition from time to time. ",[],0
NEWS,train211,212,0,cause_our_data_0_0212,"He went on to addthat ""in so doing you not only return a nation to its people,but you will destroy the war machine of a ruthless dictator.""   ","[""He went on to addthat in so <ARG0>doing</ARG0> you not only return a nation to its people,but you will <ARG1>destroy</ARG1> the war machine of a ruthless dictator.""]",1
NEWS,train124,125,0,0_our_data_0_0125,"But they failed to sell these stocks to client investors, who were cautious about the sharp gains these issues made this week, the Wako official said.    ",[],0
NEWS,train199,200,0,cause_our_data_0_0200,"Mr. Antar, the SEC said, made more than $60 million from the sale of his shares between 1985 and 1987.    ","[""Mr. Antar, the SEC said, <ARG1>made</ARG1> more than $60 million from the <ARG0>sale</ARG0> of his shares between 1985 and 1987.""]",1
