context,triplets
"so you need to install it beforehand in order to utilize the software.
Then,
the computer will be enabled to perform its intended function effectively.",<triplet> so you need to install it beforehand in order to utilize the software. <subj> the computer will be enabled to perform its intended function effectively. <obj> enable
"If the key is
inserted into the lock
then the door can be opened.",<triplet> If the key is <subj> then the door can be opened. <obj> enable
"The car alarm will be triggered
if
someone tries to open the door when the ignition is off",<triplet> The car alarm will be triggered <subj> someone tries to open the door when the ignition is off <obj> enable
is The water is boiling is  enabling   aing nooles to the pot,<triplet> is The water is boiling <subj>  aing nooles to the pot <obj> enable
"After removing the bone
,
you can enjoy",<triplet> After removing the bone <subj> you can enjoy <obj> enable
"To improve your memory skills
by practicing brain exercises like puzzles or memory games regularly and eating foods that promote cognitive function like blueberries or fish
to enhance your mental abilities and reduce the risk of age-related memory loss.",<triplet> To improve your memory skills <subj> to enhance your mental abilities and reduce the risk of age-related memory loss. <obj> enable
 A vehicle with a spare tire an jack   allows   theriver to change a flat tire quickly an safely.,<triplet>  A vehicle with a spare tire an jack <subj>  theriver to change a flat tire quickly an safely. <obj> enable
"When the light switch
is turned on,
then the room becomes bright.",<triplet> When the light switch <subj> then the room becomes bright. <obj> enable
"The light switch
is easily accessible,
allowing for quick and easy operation.",<triplet> The light switch <subj> allowing for quick and easy operation. <obj> enable
"The lightbulb has not blown
thus it allows
the room to be illuminated",<triplet> The lightbulb has not blown <subj> the room to be illuminated <obj> enable
"The light won't
turn on
unless you flip the switch.",<triplet> The light wont <subj> unless you flip the switch. <obj> enable
"Once the fire
is extinguished,
it eliminates any danger of a house fire.",<triplet> Once the fire <subj> it eliminates any danger of a house fire. <obj> enable
"If you want to run faster,
you need to train regularly.
and eat a healthy diet.","<triplet> If you want to run faster, <subj> and eat a healthy diet. <obj> enable"
"In case of emergency
you can
use the fire extinguisher to put out small flames.",<triplet> In case of emergency <subj> use the fire extinguisher to put out small flames. <obj> enable
"The car's battery is fully charged
allowing
us to embark on our long-planned road trip today",<triplet> The cars battery is fully charged <subj> us to embark on our long-planned road trip today <obj> enable
"Inserting the key into the lock
performs
the action of opening the door",<triplet> Inserting the key into the lock <subj> the action of opening the door <obj> enable
"When the water
boils
you can add noodles to the pot.",<triplet> When the water <subj> you can add noodles to the pot. <obj> enable
"The door is unlocked
If
someone can enter the room easily",<triplet> The door is unlocked <subj> someone can enter the room easily <obj> enable
"Whenever food
is covered
tightly with plastic wrap",<triplet> Whenever food <subj> tightly with plastic wrap <obj> enable
"When the light switch
is turned on,
it illuminates the room and",<triplet> When the light switch <subj> it illuminates the room and <obj> enable
"If you have
a bicycle
you can ride it to work.",<triplet> If you have <subj> you can ride it to work. <obj> enable
is If you unlock youroor with the correct key is  enabling   it to open.,<triplet> is If you unlock youroor with the correct key <subj>  it to open. <obj> enable
"If the door is
unlocked,
you can",<triplet> If the door is <subj> you can <obj> enable
"The sun's warmth
allows the plants
to grow and flourish",<triplet> The suns warmth <subj> to grow and flourish <obj> enable
"A clear pathway
allows for
safe and unobstructed movement, preventing accidents and promoting safety","<triplet> A clear pathway <subj> safe and unobstructed movement, preventing accidents and promoting safety <obj> enable"
"An airplane
can fly
When there is sufficient fuel in the tank",<triplet> An airplane <subj> When there is sufficient fuel in the tank <obj> enable
 Having a charge battery   allows  the laptop to start up easily.,<triplet>  Having a charge battery <subj>  to start up easily. <obj> enable
"The oven needs preheating for it to function correctly
so
she turned it on before baking the cake",<triplet> The oven needs preheating for it to function correctly <subj> she turned it on before baking the cake <obj> enable
"We can open the window
since
it's not raining anymore.",<triplet> We can open the window <subj> its not raining anymore. <obj> enable
"If you're trying to improve your health
eating nutritious food
will enable you to maintain a healthy weight and reduce the risk of chronic diseases.",<triplet> If youre trying to improve your health <subj> will enable you to maintain a healthy weight and reduce the risk of chronic diseases. <obj> enable
"After washing the
dishes,
it's time to put them away in their respective cabinets.",<triplet> After washing the <subj> its time to put them away in their respective cabinets. <obj> enable
"The computer's battery
is fully charged
the user to work for an extended period of time",<triplet> The computers battery <subj> the user to work for an extended period of time <obj> enable
"I get a good grade on my test
if
I can go to the movies with my friends",<triplet> I get a good grade on my test <subj> I can go to the movies with my friends <obj> enable
 Holing aoor open   allows   someone to pass through easily,<triplet>  Holing aoor open <subj>  someone to pass through easily <obj> enable
 The meicine has been prescribe by theoctor   allows  us to treat our illness effectively,<triplet>  The meicine has been prescribe by theoctor <subj>  to treat our illness effectively <obj> enable
"When the water level
reaches a certain point
the pump will turn on",<triplet> When the water level <subj> the pump will turn on <obj> enable
"When the light turns green
you can
proceed with caution and avoid any collisions.",<triplet> When the light turns green <subj> proceed with caution and avoid any collisions. <obj> enable
"If you have a headache
then
you can take some aspirin to relieve the pain.",<triplet> If you have a headache <subj> you can take some aspirin to relieve the pain. <obj> enable
"When the weather is clear
you can
go for a hike and enjoy the beautiful scenery.",<triplet> When the weather is clear <subj> go for a hike and enjoy the beautiful scenery. <obj> enable
"A fully charged battery
Ensures that
The car's electrical systems function properly.",<triplet> A fully charged battery <subj> The cars electrical systems function properly. <obj> enable
"If the fire alarm goes off,
and the fire extinguisher is within reach,
people can quickly put out small fires.","<triplet> If the fire alarm goes off, <subj> people can quickly put out small fires. <obj> enable"
"The garage door opener is activated.
When
The door will open automatically.",<triplet> The garage door opener is activated. <subj> The door will open automatically. <obj> enable
"You can access your emails if you have an internet connection,
so you don't miss
important updates from friends or work colleagues","<triplet> You can access your emails if you have an internet connection, <subj> important updates from friends or work colleagues <obj> enable"
"The phone
is charged,
enabling us to make a call or send a text message.",<triplet> The phone <subj> enabling us to make a call or send a text message. <obj> enable
"The book was too heavy to carry
so
he put it in his backpack instead.",<triplet> The book was too heavy to carry <subj> he put it in his backpack instead. <obj> enable
"If you have enough money
If
you can buy anything you want",<triplet> If you have enough money <subj> you can buy anything you want <obj> enable
"The light won't turn on
unless
she connected it to the outlet",<triplet> The light wont turn on <subj> she connected it to the outlet <obj> enable
"The sun's heat
allows
plants to grow and thrive",<triplet> The suns heat <subj> plants to grow and thrive <obj> enable
"When the train arrives
can board and take their seats
passengers can board and take their seats",<triplet> When the train arrives <subj> passengers can board and take their seats <obj> enable
"The water pressure
is high
the showerhead produces a strong stream of water",<triplet> The water pressure <subj> the showerhead produces a strong stream of water <obj> enable
"When the light switch
is
turned on, then","<triplet> When the light switch <subj> turned on, then <obj> enable"
" With enough airfare, luggage an transportation reservations   allows   you can go on vacation","<triplet>  With enough airfare, luggage an transportation reservations <subj>  you can go on vacation <obj> enable"
"When the car's brakes
are functioning properly,
it ensures safe driving.",<triplet> When the cars brakes <subj> it ensures safe driving. <obj> enable
"If you have a key
can
you open the door",<triplet> If you have a key <subj> you open the door <obj> enable
Owning a four-wheel drive vehicle empowers us to effortlessly cope with rough terrains.,<triplet> Owning a four-wheel drive vehicle <subj> us to effortlessly cope with rough terrains. <obj> enable
"If you have
a smartphone with GPS,
you can easily navigate",<triplet> If you have <subj> you can easily navigate <obj> enable
"If you turn off the lights
will make the room
darker",<triplet> If you turn off the lights <subj> darker <obj> enable
"Eating regularly,
/
sustains stable levels of blood sugar","<triplet> Eating regularly, <subj> sustains stable levels of blood sugar <obj> enable"
"When you turn on the light switch
the
room will brighten up",<triplet> When you turn on the light switch <subj> room will brighten up <obj> enable
"When the computer is turned on and connected to the internet,
the
it can access various websites.","<triplet> When the computer is turned on and connected to the internet, <subj> it can access various websites. <obj> enable"
"To turn on a gas stove
ensure that
the gas valve is in the open position",<triplet> To turn on a gas stove <subj> the gas valve is in the open position <obj> enable
"the elevator will move
as a result of
the motor's activation.",<triplet> the elevator will move <subj> the motors activation. <obj> enable
"We could not enter the room
because the key was missing
We would be able to enter the room if we had the key",<triplet> We could not enter the room <subj> We would be able to enter the room if we had the key <obj> enable
"When the air pressure
is low,
the tires",<triplet> When the air pressure <subj> the tires <obj> enable
"you can punch it down
and
roll it out for pizza toppings",<triplet> you can punch it down <subj> roll it out for pizza toppings <obj> enable
 Having a high-performance CPU   allows  for fast computing which is essential for scientific research anata analysis.,<triplet>  Having a high-performance CPU <subj>  which is essential for scientific research anata analysis. <obj> enable
"If there is sufficient light in a room
then
we can see objects clearly",<triplet> If there is sufficient light in a room <subj> we can see objects clearly <obj> enable
"The computer's battery is fully charged
allowing
us to work on it for an extended period of time.",<triplet> The computers battery is fully charged <subj> us to work on it for an extended period of time. <obj> enable
"The computer wouldn't boot up
without
first inserting the power cord into the outlet",<triplet> The computer wouldnt boot up <subj> first inserting the power cord into the outlet <obj> enable
"When the light switch is turned on
the room becomes brightly lit.
the room becomes brightly lit",<triplet> When the light switch is turned on <subj> the room becomes brightly lit <obj> enable
"the wind turbine
can efficiently
generate electricity and power homes during power outages",<triplet> the wind turbine <subj> generate electricity and power homes during power outages <obj> enable
is Whenever it rains is  enabling   you to use an umbrella.,<triplet> is Whenever it rains <subj>  you to use an umbrella. <obj> enable
"you are eligible
to
enroll in college courses",<triplet> you are eligible <subj> enroll in college courses <obj> enable
"The car has enough fuel
If
It can be driven for a long distance",<triplet> The car has enough fuel <subj> It can be driven for a long distance <obj> enable
is When you finish your homework is  enabling   you to relax an watch TV.,<triplet> is When you finish your homework <subj>  you to relax an watch TV. <obj> enable
"The car won't start
requires
a properly charged battery",<triplet> The car wont start <subj> a properly charged battery <obj> enable
"If a person has a valid license
and
their vehicle passes inspection",<triplet> If a person has a valid license <subj> their vehicle passes inspection <obj> enable
"As soon as a pilot presses the start button,
initiates
the event of takeoff.","<triplet> As soon as a pilot presses the start button, <subj> the event of takeoff. <obj> enable"
"The printer
can produce high-quality prints
if the ink cartridges are filled with fresh ink",<triplet> The printer <subj> if the ink cartridges are filled with fresh ink <obj> enable
"When the coffee maker
is set to the desired temperature
and brewing time,","<triplet> When the coffee maker <subj> and brewing time, <obj> enable"
"If you press a button on a remote control,
the
television turns on.","<triplet> If you press a button on a remote control, <subj> television turns on. <obj> enable"
"The oven is preheated
making it possible to
bake the cake perfectly",<triplet> The oven is preheated <subj> bake the cake perfectly <obj> enable
Owning a car enables travel to retail outlets with ease,<triplet> Owning a car <subj> travel to retail outlets with ease <obj> enable
"A well-stocked pantry
allows for easy meal preparation
as it provides a variety of ingredients that can be combined and cooked into delicious meals.",<triplet> A well-stocked pantry <subj> as it provides a variety of ingredients that can be combined and cooked into delicious meals. <obj> enable
"If the car battery is dead
use jumper cables to
start the engine.",<triplet> If the car battery is dead <subj> start the engine. <obj> enable
"When the wind is
strong enough,
it enables sailboats",<triplet> When the wind is <subj> it enables sailboats <obj> enable
"There is a heavy storm.
IF ... THEN...
People can protect their homes from flooding with sandbags.",<triplet> There is a heavy storm. <subj> People can protect their homes from flooding with sandbags. <obj> enable
"it can run for several miles
if
the driver presses the accelerator",<triplet> it can run for several miles <subj> the driver presses the accelerator <obj> enable
"The car's tires are flat.
Changing
Enables driving on the road.",<triplet> The cars tires are flat. <subj> Enables driving on the road. <obj> enable
 A stable internet connection   allows   Seamless vieo conferencing,<triplet>  A stable internet connection <subj>  Seamless vieo conferencing <obj> enable
"If the power is out
is out
we can use candles to light our way",<triplet> If the power is out <subj> we can use candles to light our way <obj> enable
"the soup
will
have a rich and savory flavor.",<triplet> the soup <subj> have a rich and savory flavor. <obj> enable
"With the right tools
can
complete the project efficiently",<triplet> With the right tools <subj> complete the project efficiently <obj> enable
"If the fire alarm is triggered,
the
emergency responders will be automatically dispatched to the location.","<triplet> If the fire alarm is triggered, <subj> emergency responders will be automatically dispatched to the location. <obj> enable"
"The weather forecast predicts clear skies
making it possible for us
to have a picnic outside",<triplet> The weather forecast predicts clear skies <subj> to have a picnic outside <obj> enable
"the recipient can open it and enjoy its contents
is enabled to
open it and enjoy its contents",<triplet> the recipient can open it and enjoy its contents <subj> open it and enjoy its contents <obj> enable
"In order to avoid getting lost
bring a map or use GPS on your phone
when traveling to unfamiliar places",<triplet> In order to avoid getting lost <subj> when traveling to unfamiliar places <obj> enable
"The remote control won't function
is prevented by
the lack of batteries.",<triplet> The remote control wont function <subj> the lack of batteries. <obj> enable
"If the weather is clear
you can
take a scenic drive in the countryside",<triplet> If the weather is clear <subj> take a scenic drive in the countryside <obj> enable
"The phone has been charged
allowing
us to make important calls without interruption",<triplet> The phone has been charged <subj> us to make important calls without interruption <obj> enable
"When the power goes out
can
flashlights can be used as an alternative light source.",<triplet> When the power goes out <subj> flashlights can be used as an alternative light source. <obj> enable
"the batter can be stirred
as indicated by
the wooden spoon in hand",<triplet> the batter can be stirred <subj> the wooden spoon in hand <obj> enable
 The water is boiling   enabling   us to make a cup of tea or coffee,<triplet>  The water is boiling <subj>  us to make a cup of tea or coffee <obj> enable
"With a reliable internet connection
online classes can be attended
without interruption",<triplet> With a reliable internet connection <subj> without interruption <obj> enable
"printer's paper
loads
device can print documents",<triplet> printers paper <subj> device can print documents <obj> enable
"Keeping a map handy
ensures
that I don't get lost while hiking.",<triplet> Keeping a map handy <subj> that I dont get lost while hiking. <obj> enable
"When the traffic light
turns green,
the car can",<triplet> When the traffic light <subj> the car can <obj> enable
is If you have a reliable car is  enabling   you to go on a roa trip without worrying about breakowns,<triplet> is If you have a reliable car <subj>  you to go on a roa trip without worrying about breakowns <obj> enable
"Your hands
are washed thoroughly
you can eat without any hesitation",<triplet> Your hands <subj> you can eat without any hesitation <obj> enable
"To reach a remote area
one must
cross a river.",<triplet> To reach a remote area <subj> cross a river. <obj> enable
Once a surface is dry after washing it is ready for a fresh coat of paint.,<triplet> Once a surface is dry after washing <subj> for a fresh coat of paint. <obj> enable
"When the elevator reaches your floor
causes
the doors to open automatically.",<triplet> When the elevator reaches your floor <subj> the doors to open automatically. <obj> enable
"The computer's power supply is connected.
Allowing
It to operate properly.",<triplet> The computers power supply is connected. <subj> It to operate properly. <obj> enable
"The battery
is fully charged
the device can work without running out of power.",<triplet> The battery <subj> the device can work without running out of power. <obj> enable
"When my phone
is fully charged,
I can use it for a longer time.",<triplet> When my phone <subj> I can use it for a longer time. <obj> enable
"the printer
is loaded with paper
the user can print a document",<triplet> the printer <subj> the user can print a document <obj> enable
"When the light
is switched on,
then the room becomes brighter.",<triplet> When the light <subj> then the room becomes brighter. <obj> enable
"The computer will shut down automatically
when
the battery runs out of power.",<triplet> The computer will shut down automatically <subj> the battery runs out of power. <obj> enable
"When a chef has
the necessary equipment in working condition,
they can prepare",<triplet> When a chef has <subj> they can prepare <obj> enable
"The school buses have arrived
enabling
students to get to class on time.",<triplet> The school buses have arrived <subj> students to get to class on time. <obj> enable
"The oven's temperature is set high enough
allowing
the cake to bake perfectly.",<triplet> The ovens temperature is set high enough <subj> the cake to bake perfectly. <obj> enable
 The athlete's healthy boy   enables  her to perform at her besturing the competition.,<triplet>  The athletes healthy boy <subj>  her to perform at her besturing the competition. <obj> enable
"The laptop's battery
is fully charged
completing work for an extended period without any interruption",<triplet> The laptops battery <subj> completing work for an extended period without any interruption <obj> enable
"After the rain stopped,
the flowers
began to bloom and release their fragrance.","<triplet> After the rain stopped, <subj> began to bloom and release their fragrance. <obj> enable"
 Theoor is open      entry for theelivery man with the package,<triplet>  Theoor is open <subj>  entry for theelivery man with the package <obj> enable
 you can enjoy outoor activities such as hiking or camping.   enabling   having enjoyable outoor activities such as hiking or camping,<triplet>  you can enjoy outoor activities such as hiking or camping. <subj>  having enjoyable outoor activities such as hiking or camping <obj> enable
Maintaining a steady income  enablesaffording a comfortable lifestyle,<triplet> Maintaining a steady income <subj> affording a comfortable lifestyle <obj> enable
"The door
being locked
ensures our safety in a crowded space",<triplet> The door <subj> ensures our safety in a crowded space <obj> enable
"When the alarm clock rings
triggers
I can wake up",<triplet> When the alarm clock rings <subj> I can wake up <obj> enable
"The weather was good
therefore
I went for a walk",<triplet> The weather was good <subj> I went for a walk <obj> enable
"A house is secured from intruders
when
all doors and windows",<triplet> A house is secured from intruders <subj> all doors and windows <obj> enable
"Once the door
is unlocked
you can enter the room.",<triplet> Once the door <subj> you can enter the room. <obj> enable
"engine is running smoothly,
it
enables the driver","<triplet> engine is running smoothly, <subj> enables the driver <obj> enable"
"If there is water in the swimming pool
can
swimmers can enter it",<triplet> If there is water in the swimming pool <subj> swimmers can enter it <obj> enable
"If you have a ticket
can
enter the concert hall.",<triplet> If you have a ticket <subj> enter the concert hall. <obj> enable
"When the train arrives at its final destination
passengers are advised to disembark
slowly and in an orderly fashion",<triplet> When the train arrives at its final destination <subj> slowly and in an orderly fashion <obj> enable
"If you have a swimming pool
can swim
in it during summer",<triplet> If you have a swimming pool <subj> in it during summer <obj> enable
"If the water pressure is high
,
we can take a shower",<triplet> If the water pressure is high <subj> we can take a shower <obj> enable
 Theoor was unlock   allows  us to enter the builing.,<triplet>  Theoor was unlock <subj>  us to enter the builing. <obj> enable
"In case of heavy rainfall
then
the road signs will be illuminated for better visibility",<triplet> In case of heavy rainfall <subj> the road signs will be illuminated for better visibility <obj> enable
 The suen rainfall prevente the picnic from taking place   enables  the family to have a movie night instea.,<triplet>  The suen rainfall prevente the picnic from taking place <subj>  the family to have a movie night instea. <obj> enable
"The door is unlocked
so
I can enter the room easily",<triplet> The door is unlocked <subj> I can enter the room easily <obj> enable
"the car can travel on the road without any issues
as long as
it maintains the recommended air pressure for optimal performance and handling",<triplet> the car can travel on the road without any issues <subj> it maintains the recommended air pressure for optimal performance and handling <obj> enable
"The water was too hot
preventing
us from washing our hands",<triplet> The water was too hot <subj> us from washing our hands <obj> enable
"you can bake delicious cookies.
and
the preheated oven enables you to create perfect cookie dough.",<triplet> you can bake delicious cookies. <subj> the preheated oven enables you to create perfect cookie dough. <obj> enable
"A person saves enough money
if
they can purchase their desired item without hesitation",<triplet> A person saves enough money <subj> they can purchase their desired item without hesitation <obj> enable
"the software application
can efficiently
run and function without crashing or slowing down",<triplet> the software application <subj> run and function without crashing or slowing down <obj> enable
"changes to green, The traffic light is currently re, causing aelay in traffic flow. changes to green,  enabling  cars to proce Cars can now move forwar an reach theirestination faster.","<triplet> changes to green, The traffic light is currently re, causing aelay in traffic flow. <subj>  Cars can now move forwar an reach theirestination faster. <obj> enable"
"If the window is locked securely,
it can withstand strong winds or rainstorms without breaking or leaking excess water into our room.
providing us with a safe and comfortable living environment.","<triplet> If the window is locked securely, <subj> providing us with a safe and comfortable living environment. <obj> enable"
they are If a person has a valiriver's license they are  allows  e torive on public roas,<triplet> they are If a person has a valirivers license <subj> rive on public roas <obj> enable
