context,triplets
 pays  bill cause is thanked,<triplet>  pays  bill <subj> is thanked <obj> cause
 needs a change cause frowns,<triplet>  needs a change <subj> frowns <obj> cause
 becomes a professional gamer cause gets popular,<triplet>  becomes a professional gamer <subj> gets popular <obj> cause
 finds a stray dog cause gets bitten,<triplet>  finds a stray dog <subj> gets bitten <obj> cause
 turns  towards  cause to towards the moving,<triplet>  turns towards  <subj> to towards the moving <obj> cause
 loves the song cause cries,<triplet>  loves the song <subj> cries <obj> cause
 cleans the basement cause gets dirty,<triplet>  cleans the basement <subj> gets dirty <obj> cause
 gives  some water cause no effect,<triplet>  gives  some water <subj> no effect <obj> cause
 rents and managing properties for a fee cause  gets job experience,<triplet>  rents and managing properties for a fee <subj>  gets job experience <obj> cause
 sends  instead cause  sends a card instead of a gift,<triplet>  sends instead <subj>  sends a card instead of a gift <obj> cause
 pays a visit cause grin,<triplet>  pays a visit <subj> grin <obj> cause
 notices a bad smell cause Opens door,<triplet>  notices a bad smell <subj> Opens door <obj> cause
 faces every  cause give a speech,<triplet>  faces every  <subj> give a speech <obj> cause
 gets a band aid cause cringes,<triplet>  gets a band aid <subj> cringes <obj> cause
 mounts  response cause has their question answered,<triplet>  mounts  response <subj> has their question answered <obj> cause
 surprises  with a trip cause gets a hug,<triplet>  surprises with a trip <subj> gets a hug <obj> cause
 goes halfsies cause has to share item,<triplet>  goes halfsies <subj> has to share item <obj> cause
 works all summer cause becomes productive,<triplet>  works all summer <subj> becomes productive <obj> cause
 shoots first and ask questions later cause harms someone,<triplet>  shoots first and ask questions later <subj> harms someone <obj> cause
 goes  after school cause is nervous,<triplet>  goes after school <subj> is nervous <obj> cause
 regulates  with nations cause gets income from business,<triplet>  regulates with nations <subj> gets income from business <obj> cause
 fights another day cause makes everyone fear him,<triplet>  fights another day <subj> makes everyone fear him <obj> cause
 swings  hard cause clenches muscles in anger,<triplet>  swings hard <subj> clenches muscles in anger <obj> cause
 yells for help cause people come over,<triplet>  yells for help <subj> people come over <obj> cause
 swings hard cause gets hungry,<triplet>  swings hard <subj> gets hungry <obj> cause
 gets a standing ovation cause thinks about the show,<triplet>  gets a standing ovation <subj> thinks about the show <obj> cause
 takes a hot bath cause Dries off,<triplet>  takes a hot bath <subj> Dries off <obj> cause
 cleans the yard cause gets paid,<triplet>  cleans the yard <subj> gets paid <obj> cause
 gets near  cause  feels close to ,<triplet>  gets near  <subj>  feels close to  <obj> cause
 teaches the class cause They clarify points in the lecture,<triplet>  teaches the class <subj> They clarify points in the lecture <obj> cause
 puts  in the car cause  provides safety to baby,<triplet>  puts in the car <subj>  provides safety to baby <obj> cause
 carries the  alone cause sadness,<triplet>  carries the alone <subj> sadness <obj> cause
 works with kids cause Children play games and complete tasks,<triplet>  works with kids <subj> Children play games and complete tasks <obj> cause
 is a little boy cause becomes man,<triplet>  is a little boy <subj> becomes man <obj> cause
 has lost weight cause feels good,<triplet>  has lost weight <subj> feels good <obj> cause
 returns the dog cause smiles,<triplet>  returns the dog <subj> smiles <obj> cause
 taps  cause jump in shock,<triplet>  taps  <subj> jump in shock <obj> cause
 has a bowl of cereal cause tastes the cereal flavor,<triplet>  has a bowl of cereal <subj> tastes the cereal flavor <obj> cause
 lives far away cause takes roadtrips,<triplet>  lives far away <subj> takes roadtrips <obj> cause
 talks to a friend cause smiles and laughs,<triplet>  talks to a friend <subj> smiles and laughs <obj> cause
 makes it snappy cause angry to other,<triplet>  makes it snappy <subj> angry to other <obj> cause
 sings  a song cause They finish the song,<triplet>  sings  a song <subj> They finish the song <obj> cause
 protects the  from injury cause are safe again,<triplet>  protects the from injury <subj> are safe again <obj> cause
 takes it to a mechanic cause pays the bill,<triplet>  takes it to a mechanic <subj> pays the bill <obj> cause
 is playing in the yard cause brings in bugs,<triplet>  is playing in the yard <subj> brings in bugs <obj> cause
 feels queasy cause have to sit down,<triplet>  feels queasy <subj> have to sit down <obj> cause
 maintains  level cause is respected,<triplet>  maintains  level <subj> is respected <obj> cause
 knows  was ready cause  knows  well,<triplet>  knows  was ready <subj>  knows  well <obj> cause
 wants to fight  cause gets a black eye,<triplet>  wants to fight  <subj> gets a black eye <obj> cause
 talks to oneself cause has something to listen to,<triplet>  talks to oneself <subj> has something to listen to <obj> cause
 is getting scared cause heart beats faster,<triplet>  is getting scared <subj> heart beats faster <obj> cause
 moves across the country cause gets new job,<triplet>  moves across the country <subj> gets new job <obj> cause
 walks down the street cause gets fresh air,<triplet>  walks down the street <subj> gets fresh air <obj> cause
 licks  cause Person x finds out how person y reacts to being licked,<triplet>  licks  <subj> Person x finds out how person y reacts to being licked <obj> cause
 is incredibly nervous cause develops physical symptoms,<triplet>  is incredibly nervous <subj> develops physical symptoms <obj> cause
 tastes disgusting cause X feels sick,<triplet>  tastes disgusting <subj> X feels sick <obj> cause
 has never played before cause judges,<triplet>  has never played before <subj> judges <obj> cause
 never played  cause is taught how to do something,<triplet>  never played  <subj> is taught how to do something <obj> cause
 gets  from the fridge cause NONE,<triplet>  gets from the fridge <subj> NONE <obj> cause
 is running for class president cause gets accepted to a prestigious university,<triplet>  is running for class president <subj> gets accepted to a prestigious university <obj> cause
 beats the cancer cause smiles,<triplet>  beats the cancer <subj> smiles <obj> cause
 dresses to go back out to eat cause smiles,<triplet>  dresses to go back out to eat <subj> smiles <obj> cause
 becomes  man cause gets pregnant,<triplet>  becomes  man <subj> gets pregnant <obj> cause
 laughs together cause rest,<triplet>  laughs together <subj> rest <obj> cause
 potty train  cause builds relationship,<triplet>  potty train  <subj> builds relationship <obj> cause
 comes back home cause Sees familiar sights,<triplet>  comes back home <subj> Sees familiar sights <obj> cause
 takes a class cause learns something new,<triplet>  takes a class <subj> learns something new <obj> cause
 spends  worrying cause Loses weight,<triplet>  spends worrying <subj> Loses weight <obj> cause
 cuts the cake cause eats slice of cake,<triplet>  cuts the cake <subj> eats slice of cake <obj> cause
 learns  every day cause  increases their understanding,<triplet>  learns every day <subj>  increases their understanding <obj> cause
 attracts  by offering cause Get more results,<triplet>  attracts by offering <subj> Get more results <obj> cause
 treats  badly cause avoids personx,<triplet>  treats  badly <subj> avoids personx <obj> cause
 leaves the rest to  cause takes a nap,<triplet>  leaves the rest to  <subj> takes a nap <obj> cause
 makes some extra cash cause they can spend money,<triplet>  makes some extra cash <subj> they can spend money <obj> cause
 knows the  better cause gains wisdom,<triplet>  knows the better <subj> gains wisdom <obj> cause
 breaks ground cause gets exercise,<triplet>  breaks ground <subj> gets exercise <obj> cause
 blinks several times cause to get something out of their eye,<triplet>  blinks several times <subj> to get something out of their eye <obj> cause
 loves the show cause body feels excited,<triplet>  loves the show <subj> body feels excited <obj> cause
 finally took  cause fuels their car,<triplet>  finally took  <subj> fuels their car <obj> cause
 takes  by the arm cause  is pulls away from ,<triplet>  takes  by the arm <subj>  is pulls away from  <obj> cause
 writes  a letter cause puts in envelope,<triplet>  writes  a letter <subj> puts in envelope <obj> cause
 begs  to let cause walk away,<triplet>  begs  to let <subj> walk away <obj> cause
 eats healthy things cause gets faster,<triplet>  eats healthy things <subj> gets faster <obj> cause
 falls many times cause gets headache,<triplet>  falls many times <subj> gets headache <obj> cause
 casts  upon the earth cause Gains fruit,<triplet>  casts upon the earth <subj> Gains fruit <obj> cause
 wins the race cause person x gets a trophy,<triplet>  wins the race <subj> person x gets a trophy <obj> cause
" knows what else to say cause COOMITS A CRIME, GETS ARRESTED","<triplet>  knows what else to say <subj> COOMITS A CRIME, GETS ARRESTED <obj> cause"
 parks the bus cause  is thanked,<triplet>  parks the bus <subj>  is thanked <obj> cause
 tells  this cause become more aware,<triplet>  tells  this <subj> become more aware <obj> cause
 is near  cause smiles,<triplet>  is near  <subj> smiles <obj> cause
 assumes  expression cause gestrues,<triplet>  assumes  expression <subj> gestrues <obj> cause
 becomes  engineer cause is stressed,<triplet>  becomes  engineer <subj> is stressed <obj> cause
 zig when  shoulds zag cause learns a valuable lesson,<triplet>  zig when  shoulds zag <subj> learns a valuable lesson <obj> cause
 assists  cause stay late at work,<triplet>  assists  <subj> stay late at work <obj> cause
 spends  visiting cause sees different things,<triplet>  spends visiting <subj> sees different things <obj> cause
 makes  harder cause makes more money,<triplet>  makes harder <subj> makes more money <obj> cause
 throws  on the floor cause is wounded by dropped object,<triplet>  throws on the floor <subj> is wounded by dropped object <obj> cause
 moves across town cause buys furniture,<triplet>  moves across town <subj> buys furniture <obj> cause
 really hurt  cause resents personX,<triplet>  really hurt  <subj> resents personX <obj> cause
 is time to perform cause they go onstage,<triplet>  is time to perform <subj> they go onstage <obj> cause
 affords to buy one cause makes a purchase,<triplet>  affords to buy one <subj> makes a purchase <obj> cause
 shapes the character  cause meeting,<triplet>  shapes the character  <subj> meeting <obj> cause
 buys the part cause spends money,<triplet>  buys the part <subj> spends money <obj> cause
 gets a pet cause teaches tricks,<triplet>  gets a pet <subj> teaches tricks <obj> cause
 also asked  cause listens,<triplet>  also asked  <subj> listens <obj> cause
 screams at  cause Screams,<triplet>  <ARG1>Screams</ARG1> at  <subj> Screams <obj> cause
 is grounded for a month cause protests,<triplet>  is grounded for a month <subj> protests <obj> cause
 is washing dishes cause rinses soap off,<triplet>  is washing dishes <subj> rinses soap off <obj> cause
 suffers another  cause is hospitalized,<triplet>  suffers another  <subj> is hospitalized <obj> cause
 tells  mom cause y gets grounded,<triplet>  tells  mom <subj> y gets grounded <obj> cause
 decides to call  cause picks up phone,<triplet>  decides to call  <subj> picks up phone <obj> cause
 comes across  cause gains knowledge,<triplet>  comes across  <subj> gains knowledge <obj> cause
 has low self esteem cause feels unloved,<triplet>  has low self esteem <subj> feels unloved <obj> cause
 gives  some tips cause receives tips back,<triplet>  gives  some tips <subj> receives tips back <obj> cause
 decides to major cause gets class schedule,<triplet>  decides to major <subj> gets class schedule <obj> cause
 frightens away  cause Gets thanked,<triplet>  frightens away  <subj> Gets thanked <obj> cause
 pays  attention cause Hears story,<triplet>  pays  attention <subj> Hears story <obj> cause
 supports  cause receives a hug,<triplet>  supports  <subj> receives a hug <obj> cause
 drives  there cause wants to go back home,<triplet>  drives  there <subj> wants to go back home <obj> cause
 reinvents the wheel cause files for a patent,<triplet>  reinvents the wheel <subj> files for a patent <obj> cause
 knows  in the biblical sense cause gains more knowledge about ,<triplet>  knows  in the biblical sense <subj> gains more knowledge about  <obj> cause
 determines precisely the  cause become knowledgeable,<triplet>  determines precisely the  <subj> become knowledgeable <obj> cause
 is afraid at first cause overcomes fears,<triplet>  is afraid at first <subj> overcomes fears <obj> cause
 makes the dough cause gets their hands dirty,<triplet>  makes the dough <subj> gets their hands dirty <obj> cause
 fights hand to hand cause Person X breaks his wrist.,<triplet>  fights hand to hand <subj> Person X breaks his wrist. <obj> cause
 takes about an hour cause falls behind,<triplet>  takes about an hour <subj> falls behind <obj> cause
 overcomes  with good cause saves a life,<triplet>  overcomes with good <subj> saves a life <obj> cause
 wants kids cause They imagine their lives with children.,<triplet>  wants kids <subj> They imagine their lives with children. <obj> cause
 has to go to school cause grows bored,<triplet>  has to go to school <subj> grows bored <obj> cause
 has a great job cause gets big paychecks,<triplet>  has a great job <subj> gets big paychecks <obj> cause
 finds the source of the noise cause sees mice,<triplet>  finds the source of the noise <subj> sees mice <obj> cause
 calls the cops on  cause they fill out a report,<triplet>  calls the cops on  <subj> they fill out a report <obj> cause
 mows my lawn cause finishes a task.,<triplet>  mows my lawn <subj> finishes a task. <obj> cause
 sees  too cause nods,<triplet>  sees  too <subj> nods <obj> cause
 puts my arm around  cause gets startled,<triplet>  puts my arm around  <subj> gets startled <obj> cause
 takes a lot of pictures cause gains experience,<triplet>  takes a lot of pictures <subj> gains experience <obj> cause
 pays  to caesar cause goes back home,<triplet>  pays to caesar <subj> goes back home <obj> cause
 serves it to  cause Finish breakfast,<triplet>  serves it to  <subj> Finish breakfast <obj> cause
 wants nothing to do with  cause sees X years later,<triplet>  wants nothing to do with  <subj> sees X years later <obj> cause
 receives an email cause answers email,<triplet>  receives an email <subj> answers email <obj> cause
 sends  to school cause person x rests,<triplet>  sends  to school <subj> person x rests <obj> cause
 throws open the  cause bleeds,<triplet>  throws open the  <subj> bleeds <obj> cause
 spills the tea cause floor spills with tea,<triplet>  spills the tea <subj> floor spills with tea <obj> cause
 swerves to avoid it cause Saves something from being destroyed,<triplet>  swerves to avoid it <subj> Saves something from being destroyed <obj> cause
 eats spinach cause Washes the dishes,<triplet>  eats spinach <subj> Washes the dishes <obj> cause
 sends a text cause hears their phone,<triplet>  sends a text <subj> hears their phone <obj> cause
 never liked  cause avoids the disliked item,<triplet>  never liked  <subj> avoids the disliked item <obj> cause
 spits  out cause is wet,<triplet>  spits  out <subj> is wet <obj> cause
 persuades the  to adopt cause improves life,<triplet>  persuades the to adopt <subj> improves life <obj> cause
 quickly put  cause Person X plays football.,<triplet>  quickly put  <subj> Person X plays football. <obj> cause
 goes fishing  cause Finds a new spot,<triplet>  goes fishing  <subj> Finds a new spot <obj> cause
 says hello to  cause Asks X abotu how things are,<triplet>  says hello to  <subj> Asks X abotu how things are <obj> cause
 walks home from school one  cause breathes heavily.,<triplet>  walks home from school one  <subj> breathes heavily. <obj> cause
 goes  yesterday cause Notices X,<triplet>  goes yesterday <subj> Notices X <obj> cause
 is best for  cause falls in love,<triplet>  is best for  <subj> falls in love <obj> cause
 shoots a deer cause runs away,<triplet>  shoots a deer <subj> runs away <obj> cause
 thinks it was cute cause sensitive,<triplet>  thinks it was cute <subj> sensitive <obj> cause
 watches  on tv cause relaxes,<triplet>  watches on tv <subj> relaxes <obj> cause
 sounds  alarm cause Jumps back in surprise,<triplet>  sounds  alarm <subj> Jumps back in surprise <obj> cause
 gets a hit cause celebrates,<triplet>  gets a hit <subj> celebrates <obj> cause
 always failed cause overeats in consolation,<triplet>  always failed <subj> overeats in consolation <obj> cause
 eats fried chicken cause interested,<triplet>  eats fried chicken <subj> interested <obj> cause
 takes some time cause gets yelled at to hurry up,<triplet>  takes some time <subj> gets yelled at to hurry up <obj> cause
 looks pretty cause wants to make  more pretty,<triplet>  looks pretty <subj> wants to make more pretty <obj> cause
 diverts  away cause checks his secret account,<triplet>  diverts away <subj> checks his secret account <obj> cause
 opens the email cause have to work,<triplet>  opens the email <subj> have to work <obj> cause
 moves quickly cause Meets a deadline,<triplet>  moves quickly <subj> Meets a deadline <obj> cause
 suspends  cause becomes constrained,<triplet>  suspends  <subj> becomes constrained <obj> cause
 finally started cause On diet,<triplet>  finally started <subj> On diet <obj> cause
 uses the internet cause sending mails,<triplet>  uses the internet <subj> sending mails <obj> cause
 kicks up a fuss cause increased emotional unrest,<triplet>  kicks up a fuss <subj> increased emotional unrest <obj> cause
 punches  in the face cause feels pain in arm that punched PERSON,<triplet>  punches in the face <subj> feels pain in arm that punched PERSON <obj> cause
 wakes up  morning cause FEELING RELEAXED,<triplet>  wakes up morning <subj> FEELING RELEAXED <obj> cause
 runs everyday cause person x heart gets stronger,<triplet>  runs everyday <subj> person x heart gets stronger <obj> cause
 spends  to make cause Makes enough to retire,<triplet>  spends to make <subj> Makes enough to retire <obj> cause
 retrieves the ball cause extend their arms,<triplet>  retrieves the ball <subj> extend their arms <obj> cause
 moves to a new area cause buys a house,<triplet>  moves to a new area <subj> buys a house <obj> cause
 points a gun cause screams,<triplet>  points a gun <subj> screams <obj> cause
 renders  to the cause cause become aware of a new case,<triplet>  renders to the cause <subj> become aware of a new case <obj> cause
 buys the dress cause wears the dress,<triplet>  buys the dress <subj> wears the dress <obj> cause
 about to get married cause says yes,<triplet>  about to get married <subj> says yes <obj> cause
 has back pain cause person x takes a hot bath,<triplet>  has back pain <subj> person x takes a hot bath <obj> cause
 serves it to  cause sharing the food,<triplet>  serves it to  <subj> sharing the food <obj> cause
 laughs and told  cause is nice,<triplet>  laughs and told  <subj> is nice <obj> cause
 kills every  cause are unable to move anymore,<triplet>  kills every  <subj> are unable to move anymore <obj> cause
 takes  to court cause  goes to jail,<triplet>  takes  to court <subj>  goes to jail <obj> cause
 makes  really happy cause greatful to personX,<triplet>  makes  really happy <subj> greatful to personX <obj> cause
 schools every day cause gains knowledge,<triplet>  schools every day <subj> gains knowledge <obj> cause
 expects  answer cause re-evaluates their tutoring methods,<triplet>  expects  answer <subj> re-evaluates their tutoring methods <obj> cause
 eats spaghetti cause Gets stomach cramps,<triplet>  eats spaghetti <subj> Gets stomach cramps <obj> cause
 eagerly awaited cause got it in time,<triplet>  eagerly awaited <subj> got it in time <obj> cause
 increases  by increasing cause pumps fists in excitement,<triplet>  increases by increasing <subj> pumps fists in excitement <obj> cause
 tells it like it is cause gets called names,<triplet>  tells it like it is <subj> gets called names <obj> cause
 breaks my leg cause calls an ambulance,<triplet>  breaks my leg <subj> calls an ambulance <obj> cause
 finds  at a store cause jumps up in joy,<triplet>  finds at a store <subj> jumps up in joy <obj> cause
 drinks the milk cause  cramps due to being lactose intolerantq,<triplet>  drinks the milk <subj>  cramps due to being lactose intolerantq <obj> cause
 bumps  cause Person X sees how far they bump person y,<triplet>  bumps  <subj> Person X sees how far they bump person y <obj> cause
 wears  everywhere cause laughed at,<triplet>  wears everywhere <subj> laughed at <obj> cause
 arrives in  cause person y walks away from person x.,<triplet>  arrives in  <subj> person y walks away from person x. <obj> cause
 finds my keys cause Gives handshake,<triplet>  finds my keys <subj> Gives handshake <obj> cause
 permits  to enter cause greets person,<triplet>  permits to enter <subj> greets person <obj> cause
 is having a lot of fun cause heart rate increases,<triplet>  is having a lot of fun <subj> heart rate increases <obj> cause
 speaks  well cause increased understanding from others,<triplet>  speaks well <subj> increased understanding from others <obj> cause
 takes  to the counter cause is told the price he needs to pay,<triplet>  takes to the counter <subj> is told the price he needs to pay <obj> cause
 prevents  to others cause is well thought of,<triplet>  prevents to others <subj> is well thought of <obj> cause
 asks if  could help cause Needs more help,<triplet>  asks if  could help <subj> Needs more help <obj> cause
 studies abroad cause he is smarter,<triplet>  studies abroad <subj> he is smarter <obj> cause
 takes a drink cause  visits the restroom,<triplet>  takes a drink <subj>  visits the restroom <obj> cause
 considers  in terms cause  changes their opinion,<triplet>  considers in terms <subj>  changes their opinion <obj> cause
 is shopping at the grocery store cause slips on wet floor,<triplet>  is shopping at the grocery store <subj> slips on wet floor <obj> cause
 evens asked  cause reveal,<triplet>  evens asked  <subj> reveal <obj> cause
 knows that  well cause is confident,<triplet>  knows that well <subj> is confident <obj> cause
 plays the clarinet cause makes beautiful music,<triplet>  plays the clarinet <subj> makes beautiful music <obj> cause
 enjoys the music cause personx taps their feet,<triplet>  enjoys the music <subj> personx taps their feet <obj> cause
 usually made  cause Genius decision,<triplet>  usually made  <subj> Genius decision <obj> cause
 protects the  from attack cause Person x is heralded a hero,<triplet>  protects the from attack <subj> Person x is heralded a hero <obj> cause
 assembles  cause gets thanked,<triplet>  assembles  <subj> gets thanked <obj> cause
 lets go and let god cause tries to   be with God,<triplet>  lets go and let god <subj> tries to be with God <obj> cause
 studies with  cause is invited to coffee,<triplet>  studies with  <subj> is invited to coffee <obj> cause
 takes a shower cause gets clean,<triplet>  takes a shower <subj> gets clean <obj> cause
 stabs  in the back cause gets arrested,<triplet>  stabs  in the back <subj> gets arrested <obj> cause
 keeps  record cause receives compensation,<triplet>  keeps  record <subj> receives compensation <obj> cause
 is too much for  cause gets bothered,<triplet>  is too much for  <subj> gets bothered <obj> cause
 attracts  by offering cause Achieve Success,<triplet>  attracts by offering <subj> Achieve Success <obj> cause
 sees  home cause drives past,<triplet>  sees  home <subj> drives past <obj> cause
 gives the class  cause find the best one,<triplet>  gives the class  <subj> find the best one <obj> cause
 works closely with  cause gets to know  better,<triplet>  works closely with  <subj> gets to know  better <obj> cause
 finds  in the garbage cause throws it back out,<triplet>  finds in the garbage <subj> throws it back out <obj> cause
 sends  to college cause Study hard,<triplet>  sends to college <subj> Study hard <obj> cause
 takes a cab home cause no effect,<triplet>  takes a cab home <subj> no effect <obj> cause
 turns the  away cause Redirects attention,<triplet>  turns the away <subj> Redirects attention <obj> cause
 is desperate for money cause does something illegal,<triplet>  is desperate for money <subj> does something illegal <obj> cause
 plays bingo cause wins a prize,<triplet>  plays bingo <subj> wins a prize <obj> cause
 gets a checkup cause Seeks treatment,<triplet>  gets a checkup <subj> Seeks treatment <obj> cause
 is moving to a new town cause get a new place to live,<triplet>  is moving to a new town <subj> get a new place to live <obj> cause
 learns computer programming cause too learns computer programing,<triplet>  learns computer programming <subj> too learns computer programing <obj> cause
 begins  soon cause becomes energetic,<triplet>  begins soon <subj> becomes energetic <obj> cause
 inspects every  cause forms an opinion,<triplet>  inspects every  <subj> forms an opinion <obj> cause
 gives  a hug cause feels person X,<triplet>  gives a hug <subj> feels person X <obj> cause
 begins to feel ill cause gets a fever,<triplet>  begins to feel ill <subj> gets a fever <obj> cause
 lays  by side cause everyone dies except his mother,<triplet>  lays by side <subj> everyone dies except his mother <obj> cause
