context,triplets
"Investing in quality equipment and tools for work, sports, or hobbies prevents injuries or damage to the equipment due to inferior quality, leading to costly repairs or replacements.","<triplet> Investing in quality equipment and tools for work, sports, or hobbies <subj> injuries or damage to the equipment due to inferior quality, leading to costly repairs or replacements. <obj> prevent"
"Keeping your pets on a leash or indoors can prevent them from running away, getting lost, or causing accidents.","<triplet> Keeping your pets on a leash or indoors <subj> them from running away, getting lost, or causing accidents. <obj> prevent"
" Wearing appropriate safety gear and using machinery or equipment safely prevents accidents, injuries, or fatalities on the job","<triplet> Wearing appropriate safety gear and using machinery or equipment safely <subj> accidents, injuries, or fatalities on the job <obj> prevent"
"Wearing a condom during sexual activity prevents pregnancy, sexually transmitted infections, and other unwanted consequences of unprotected sex.","<triplet> Wearing a condom during sexual activity <subj> pregnancy, sexually transmitted infections, and other unwanted consequences of unprotected sex. <obj> prevent"
"Regularly inspecting equipment for wear and tear prevents sudden equipment failure or malfunction, which can result in accidents, injuries, or loss of productivity.","<triplet> Regularly inspecting equipment for wear and tear <subj> sudden equipment failure or malfunction, which can result in accidents, injuries, or loss of productivity. <obj> prevent"
Using seat belts while driving prevents fatalities in car accidents by reducing the risk of ejection from the vehicle.,<triplet> Using seat belts while driving <subj> fatalities in car accidents by reducing the risk of ejection from the vehicle. <obj> prevent
"Wearing sunscreen with an SPF of 30 or higher prevents skin cancer, especially in areas with high UV indexes.","<triplet> Wearing sunscreen with an SPF of 30 or higher <subj> skin cancer, especially in areas with high UV indexes. <obj> prevent"
Using a seat belt while driving can prevent injuries and fatalities caused by not wearing a seat belt during a car crash.,<triplet> Using a seat belt <subj> injuries and fatalities caused by not wearing a seat belt during a car crash. <obj> prevent
"Properly storing hazardous materials like paint, bleach, and gasoline can prevent spills and leaks that could pollute water supplies and harm wildlife.",<triplet> Properly storing hazardous materials <subj> spills and leaks that could pollute water supplies and harm wildlife. <obj> prevent
"Following safe driving practices, such as wearing seatbelts and avoiding distracted driving prevents accidents and injuries that can cause significant emotional trauma for drivers, passengers, and their families.","<triplet> Following safe driving practices, such as wearing seatbelts and avoiding distracted driving <subj> accidents and injuries that can cause significant emotional trauma for drivers, passengers, and their families. <obj> prevent"
Locking the doors and windows at night can prevent intruders from breaking in and stealing your belongings or harming you,<triplet> Locking the doors and windows at night <subj> intruders from breaking in and stealing your belongings or harming you <obj> prevent
"Installing smoke detectors in the house prevents undetected fires that could cause injury, damage, or death to people and pets inside.","<triplet> Installing smoke detectors in the house <subj> undetected fires that could cause injury, damage, or death to people and pets inside. <obj> prevent"
Practicing safe sex with the use of barrier contraception can prevent unwanted pregnancies and the spread of STIs.,<triplet> Practicing safe sex with the use of barrier contraception <subj> unwanted pregnancies and the spread of STIs. <obj> prevent
"Investing in a reliable flood insurance policy prevents financial devastation due to water damage from floods, which can cause significant financial loss, especially for businesses located in vulnerable areas.","<triplet> Investing in a reliable flood insurance policy <subj> financial devastation due to water damage from floods, which can cause significant financial loss, especially for businesses located in vulnerable areas. <obj> prevent"
"Practicing safe sex prevents unintended pregnancy, sexually transmitted infections, and related health problems.","<triplet> Practicing safe sex <subj> unintended pregnancy, sexually transmitted infections, and related health problems. <obj> prevent"
Applying mosquito repellent aids in avoiding mosquito-borne diseases such as malaria and dengue fever,<triplet> Applying mosquito repellent <subj> avoiding mosquito-borne diseases such as malaria and dengue fever <obj> prevent
Following proper hand washing techniques prevents the spread of infectious diseases.,<triplet> Following proper hand washing techniques <subj> the spread of infectious diseases. <obj> prevent
"Taking regular breaks and resting for prolonged standing periods during work or other activities prevents fatigue-related injuries like falls, slips, and trips.","<triplet> Taking regular breaks and resting for prolonged standing periods during work or other activities <subj> fatigue-related injuries like falls, slips, and trips. <obj> prevent"
"Using caution when cooking, particularly when using hot oil or stoves prevents burns or fires caused by careless handling or poor kitchen practices.","<triplet> Using caution when cooking, particularly when using hot oil or stoves <subj> burns or fires caused by careless handling or poor kitchen practices. <obj> prevent"
Using a fire extinguisher in case of emergency prevents a catastrophic and deadly house fire.,<triplet> Using a fire extinguisher in case of emergency <subj> a catastrophic and deadly house fire. <obj> prevent
"Avoiding distractions while driving prevents accidents, injuries, and fatalities on the road.","<triplet> Avoiding distractions while driving <subj> accidents, injuries, and fatalities on the road. <obj> prevent"
 Using a locking mechanism on doors or windows in high-crime areas prevents burglaries and break-ins,<triplet> Using a locking mechanism on doors or windows in high-crime areas <subj> burglaries and break-ins <obj> prevent
Keeping a clean and organized workspace prevents accidents caused by clutter or disorganization.,<triplet> Keeping a clean and organized workspace <subj> accidents caused by clutter or disorganization. <obj> prevent
 Not using cell phones while driving prevents car accidents caused by distracted drivers,<triplet> Not using cell phones while driving <subj> car accidents caused by distracted drivers <obj> prevent
 Holding staff training sessions prevents mistakes or errors in routine tasks and procedures,<triplet> Holding staff training sessions <subj> mistakes or errors in routine tasks and procedures <obj> prevent
"Cleaning and disinfecting surfaces frequently prevents the spread of germs and illnesses, especially during flu season.","<triplet> Cleaning and disinfecting surfaces frequently <subj> the spread of germs and illnesses, especially during flu season. <obj> prevent"
"Taking regular breaks and practicing good posture while working at a computer prevents eye strain, back pain, or other related health issues.","<triplet> Taking regular breaks and practicing good posture while working at a computer <subj> eye strain, back pain, or other related health issues. <obj> prevent"
 Wearing sunscreen with an SPF of  or higher prevents skin cancer from forming on your face and body,<triplet> Wearing sunscreen with an SPF of or higher <subj> skin cancer from forming on your face and body <obj> prevent
"Avoiding smoking prevents lung cancer, emphysema, and other related respiratory diseases.","<triplet> Avoiding smoking <subj> lung cancer, emphysema, and other related respiratory diseases. <obj> prevent"
"Washing your hands thoroughly with soap and water before preparing food can prevent the spread of foodborne illnesses such as salmonella, e. coli, and listeria.","<triplet> Washing your hands thoroughly with soap and water before preparing food <subj> the spread of foodborne illnesses such as salmonella, e. coli, and listeria. <obj> prevent"
" Using a condom during sexual activity prevents unintended pregnancies, sexually transmitted infections (STIs), and HIV transmission","<triplet> Using a condom during sexual activity <subj> unintended pregnancies, sexually transmitted infections (STIs), and HIV transmission <obj> prevent"
 Installing smoke detectors in the house prevents deaths due to fire-related accidents,<triplet> Installing smoke detectors in the house <subj> deaths due to fire-related accidents <obj> prevent
"Replacing damaged batteries immediately and properly disposing of them prevents leaks, fires, or explosions caused by overcharging or improper handling of the battery.","<triplet> Replacing damaged batteries immediately and properly disposing of them <subj> leaks, fires, or explosions caused by overcharging or improper handling of the battery. <obj> prevent"
shields your skin from harmful UV rays and hence stops the heightened chance of skin cancer in the future,<triplet> shields your skin from harmful UV rays <subj> the heightened chance of skin cancer in the future <obj> prevent
Maintaining a safe distance between cars while driving prevents rear-end collisions and minimizes damage to both vehicles involved.,<triplet> Maintaining a safe distance between cars while driving <subj> rear-end collisions and minimizes damage to both vehicles involved. <obj> prevent
"Using a lockbox for valuables and keeping it hidden from view prevents theft of valuable items such as jewelry, cash, or electronic equipment by burglars or other thieves.","<triplet> Using a lockbox for valuables and keeping it hidden from view <subj> theft of valuable items such as jewelry, cash, or electronic equipment by burglars or other thieves. <obj> prevent"
"Locking up valuables and securing the premises before leaving a building prevents theft, burglary, or vandalism that can result in significant financial losses, property damage, or even personal injury.","<triplet> Locking up valuables and securing the premises before leaving a building <subj> theft, burglary, or vandalism that can result in significant financial losses, property damage, or even personal injury. <obj> prevent"
"Using proper cleaning techniques when working with chemicals, solvents, or other hazardous materials prevents inhalation, ingestion, or contact with the material, which can result in serious health consequences.","<triplet> Using proper cleaning techniques when working with chemicals, solvents, or other hazardous materials <subj> inhalation, ingestion, or contact with the material, which can result in serious health consequences. <obj> prevent"
 Using a bike lock to secure it in place prevents theft and damage to the bicycle,<triplet> Using a bike lock to secure it in place <subj> theft and damage to the bicycle <obj> prevent
Practicing safe sex prevents unintended pregnancies and the spread of sexually transmitted diseases (STDs).,<triplet> Practicing safe sex <subj> unintended pregnancies and the spread of sexually transmitted diseases (STDs). <obj> prevent
"Eating a balanced diet rich in vegetables, whole grains, and lean protein prevents obesity, heart disease, and diabetes, which are all linked to poor nutrition.","<triplet> Eating a balanced diet rich in vegetables, whole grains, and lean protein <subj> obesity, heart disease, and diabetes, which are all linked to poor nutrition. <obj> prevent"
"Following proper storage guidelines for medications prevents expiration, spoilage, or contamination.","<triplet> Following proper storage guidelines for medications <subj> expiration, spoilage, or contamination. <obj> prevent"
Staying away from crowded areas prevents the transmission of infectious diseases through close contact with others.,<triplet> Staying away from crowded areas <subj> the transmission of infectious diseases through close contact with others. <obj> prevent
"Practicing safe sex and using contraception prevents unwanted pregnancies caused by unprotected sexual activity, as well as the transmission of STDs through contact with bodily fluids.","<triplet> Practicing safe sex and using contraception <subj> unwanted pregnancies caused by unprotected sexual activity, as well as the transmission of STDs through contact with bodily fluids. <obj> prevent"
Getting a regular health checkup prevents overlooked medical issues developing into severe conditions,<triplet> Getting a regular health checkup <subj> overlooked medical issues developing into severe conditions <obj> prevent
Taking antibiotics according to the prescription prevents the development of antibiotic-resistant bacteria and infections,<triplet> Taking antibiotics according to the prescription <subj> the development of antibiotic-resistant bacteria and infections <obj> prevent
Following proper food handling guidelines and cooking temperatures when preparing meat products prevents foodborne illnesses caused by undercooked or contaminated meat.,<triplet> Following proper food handling guidelines and cooking temperatures when preparing meat products <subj> foodborne illnesses caused by undercooked or contaminated meat. <obj> prevent
 Installing a firewall and implementing strong password policies on all network devices prevents unauthorized access to sensitive data by hackers,<triplet> Installing a firewall and implementing strong password policies on all network devices <subj> unauthorized access to sensitive data by hackers <obj> prevent
 Using a bike lane or designated pedestrian walkway prevents collisions with vehicles and other accidents involving cyclists and pedestrians,<triplet> Using a bike lane or designated pedestrian walkway <subj> collisions with vehicles and other accidents involving cyclists and pedestrians <obj> prevent
Using a helmet while cycling or riding a motorcycle can prevent head injuries and fatalities.,<triplet> Using a helmet while cycling or riding a motorcycle <subj> head injuries and fatalities. <obj> prevent
 Having a first aid kit at home or workplace prevents life-threatening emergencies due to lack of basic medical care,<triplet> Having a first aid kit at home or workplace <subj> life-threatening emergencies due to lack of basic medical care <obj> prevent
Wearing protective gear during construction or renovation work prevents injuries due to falling objects or debris,<triplet> Wearing protective gear during construction or renovation work <subj> injuries due to falling objects or debris <obj> prevent
"Eating a healthy diet rich in fruits, vegetables, whole grains, and lean protein prevents chronic health problems such as heart disease, stroke, and certain cancers.","<triplet> Eating a healthy diet rich in fruits, vegetables, whole grains, and lean protein <subj> chronic health problems such as heart disease, stroke, and certain cancers. <obj> prevent"
"Enforcing strict gun control laws that restrict sales of automatic weapons or high-capacity magazines prevents mass shootings and other acts of gun violence in schools, malls, or public places","<triplet> Enforcing strict gun control laws that restrict sales of automatic weapons or high-capacity magazines <subj> mass shootings and other acts of gun violence in schools, malls, or public places <obj> prevent"
 Wearing reflective clothing during night runs/walks prevents being hit by a car due to lack of visibility,<triplet> Wearing reflective clothing during night runs/walks <subj> being hit by a car due to lack of visibility <obj> prevent
Using a fire extinguisher in case of an emergency prevents fires from spreading rapidly.,<triplet> Using a fire extinguisher in case of an emergency <subj> fires from spreading rapidly. <obj> prevent
"Taking regular breaks during long periods of sitting or standing can prevent muscle strain, fatigue, or other discomfort caused by prolonged inactivity","<triplet> Taking regular breaks during long periods of sitting or standing <subj> muscle strain, fatigue, or other discomfort caused by prolonged inactivity <obj> prevent"
" Limiting the consumption of processed foods and sugary drinks prevents obesity, diabetes, and heart disease","<triplet> Limiting the consumption of processed foods and sugary drinks <subj> obesity, diabetes, and heart disease <obj> prevent"
" Using a hands-free device while driving prevents distracted driving accidents caused by texting, talking on the phone, or other actions","<triplet> Using a hands-free device while driving <subj> distracted driving accidents caused by texting, talking on the phone, or other actions <obj> prevent"
"Maintaining proper tire pressure prevents blowouts and extends the lifespan of tires, which can save money on replacements over time.","<triplet> Maintaining proper tire pressure <subj> blowouts and extends the lifespan of tires, which can save money on replacements over time. <obj> prevent"
"Investing in regular maintenance and upkeep of your vehicle prevents breakdowns, accidents, or other issues that can be costly and time-consuming to repair.","<triplet> Investing in regular maintenance and upkeep of your vehicle <subj> breakdowns, accidents, or other issues that can be costly and time-consuming to repair. <obj> prevent"
Installing a firewall on your computer prevents unauthorized access to your data by viruses and malware.,<triplet> Installing a firewall on your computer <subj> unauthorized access to your data by viruses and malware. <obj> prevent
 Covering a pool with a cover  prevents water evaporation during the hot summer months,<triplet> Covering a pool with a cover  <subj> water evaporation during the hot summer months <obj> prevent
Taking medication as prescribed by your doctor can prevent serious health complications,<triplet> Taking medication as prescribed by your doctor <subj> serious health complications <obj> prevent
"Practicing safe sex by using condoms and birth control methods can prevent unwanted pregnancies, sexually transmitted infections (STIs), and other adverse consequences of unprotected sexual activity","<triplet> Practicing safe sex by using condoms and birth control methods <subj> unwanted pregnancies, sexually transmitted infections (STIs), and other adverse consequences of unprotected sexual activity <obj> prevent"
 Following traffic rules and signals prevents causing accidents on the road ,<triplet> Following traffic rules and signals <subj> causing accidents on the road  <obj> prevent
Locking doors at night or during absences prevents burglaries and thefts,<triplet> Locking doors at night or during absences <subj> burglaries and thefts <obj> prevent
"Storing hazardous materials securely and safely prevents accidents, spills, or leaks that could result in serious health consequences or environmental damage.","<triplet> Storing hazardous materials securely and safely <subj> accidents, spills, or leaks that could result in serious health consequences or environmental damage. <obj> prevent"
" Conducting regular maintenance on appliances and equipment prevents malfunctions, breakdowns, and costly repairs due to neglect or lack of upkeep","<triplet> Conducting regular maintenance on appliances and equipment <subj> malfunctions, breakdowns, and costly repairs due to neglect or lack of upkeep <obj> prevent"
Using a secure password for online accounts can prevent hackers from stealing sensitive information,<triplet> Using a secure password for online accounts <subj> hackers from stealing sensitive information <obj> prevent
Keeping your home free from pests prevents the spread of diseases and allergies caused by insects or rodents.,<triplet> Keeping your home free from pests <subj> the spread of diseases and allergies caused by insects or rodents. <obj> prevent
"Avoiding smoking, drinking, and drug use can prevent addiction, health problems, and social issues.","<triplet> Avoiding smoking, drinking, and drug use <subj> addiction, health problems, and social issues. <obj> prevent"
"Putting away dangerous toys and keeping them out of reach from young children can prevent choking, suffocation, and other accidents that may result in serious injury or death.","<triplet> Putting away dangerous toys and keeping them out of reach from young children <subj> choking, suffocation, and other accidents that may result in serious injury or death. <obj> prevent"
"Using a secure and locked gate around your property prevents unauthorized access to your home, which can lead to theft or vandalism.","<triplet> Using a secure and locked gate around your property <subj> unauthorized access to your home, which can lead to theft or vandalism. <obj> prevent"
"Regularly check the oil levels, tire pressure, and other important fluids prevents a costly repair bill or a dangerous breakdown on the side of the road.","<triplet> Regularly check the oil levels, tire pressure, and other important fluids <subj> a costly repair bill or a dangerous breakdown on the side of the road. <obj> prevent"
"Taking breaks and stretching frequently prevents muscle strains, injuries, or repetitive motion disorders from prolonged sitting or standing.","<triplet> Taking breaks and stretching frequently <subj> muscle strains, injuries, or repetitive motion disorders from prolonged sitting or standing. <obj> prevent"
"Exercising regularly and maintaining a healthy weight prevents obesity-related health issues such as heart disease, stroke, and diabetes.","<triplet> Exercising regularly and maintaining a healthy weight <subj> obesity-related health issues such as heart disease, stroke, and diabetes. <obj> prevent"
Following proper food handling procedures prevents foodborne illnesses and related complications.,<triplet> Following proper food handling procedures <subj> foodborne illnesses and related complications. <obj> prevent
Wearing protective gear during construction work prevents injuries from falling debris or tools,<triplet> Wearing protective gear during construction work <subj> injuries from falling debris or tools <obj> prevent
" Installing a home security system prevents break-ins, thefts, or other crimes that can cause physical harm or financial loss","<triplet> Installing a home security system <subj> break-ins, thefts, or other crimes that can cause physical harm or financial loss <obj> prevent"
Using a ladder safely and securely prevents falls or injuries from using ladders improperly.,<triplet> Using a ladder safely and securely <subj> falls or injuries from using ladders improperly. <obj> prevent
Having an easily accessible fire extinguisher in the house or workplace prevents further destruction or harm from occurring due to escalating flames.,<triplet> Having an easily accessible fire extinguisher in the house or workplace <subj> further destruction or harm from occurring due to escalating flames. <obj> prevent
Keeping children away from dangerous toys prevents accidents caused by the toys that can lead to injuries or even death.,<triplet> Keeping children away from dangerous toys <subj> accidents caused by the toys that can lead to injuries or even death. <obj> prevent
" Using public transportation instead of driving alone prevents air pollution, traffic congestion, and accidents caused by personal vehicles","<triplet> Using public transportation instead of driving alone <subj> air pollution, traffic congestion, and accidents caused by personal vehicles <obj> prevent"
"Using a high-quality and well-maintained equipment such as tools, machinery, or vehicles prevents malfunctions, breakdowns, or accidents caused by poor maintenance or defective parts.","<triplet> Using a high-quality and well-maintained equipment such as tools, machinery, or vehicles <subj> malfunctions, breakdowns, or accidents caused by poor maintenance or defective parts. <obj> prevent"
Using eco-friendly products and practices prevents pollution and environmental damage.,<triplet> Using eco-friendly products and practices <subj> pollution and environmental damage. <obj> prevent
Locking the doors and windows at night prevents burglaries and break-ins,<triplet> Locking the doors and windows at night <subj> burglaries and break-ins <obj> prevent
Using a condom during sexual activity prevents pregnancy and STDs caused by not using a condom during sexual activity.,<triplet> Using a condom during sexual activity <subj> pregnancy and STDs caused by not using a condom during sexual activity. <obj> prevent
"Eating a balanced diet prevents chronic diseases like heart disease, stroke and diabetes","<triplet> Eating a balanced diet <subj> chronic diseases like heart disease, stroke and diabetes <obj> prevent"
Installing smoke detectors in the house prevents a fire from causing damage to property and harm to occupants.,<triplet> Installing smoke detectors in the house <subj> a fire from causing damage to property and harm to occupants. <obj> prevent
 Covering food properly and storing it at appropriate temperatures prevents foodborne illnesses caused by bacteria growth or contamination,<triplet> Covering food properly and storing it at appropriate temperatures <subj> foodborne illnesses caused by bacteria growth or contamination <obj> prevent
"Keeping your phone out of reach during thunderstorms can prevent damage to the device caused by lightning strikes, which can result in loss of data and expensive repairs.","<triplet> Keeping your phone out of reach <subj> damage to the device caused by lightning strikes, which can result in loss of data and expensive repairs. <obj> prevent"
 Using a seatbelt when driving on the road prevents serious injuries in case of an accident,<triplet> Using a seatbelt when driving on the road <subj> serious injuries in case of an accident <obj> prevent
